start,duration,text
1214.0400000000002,1.9199999999998454," All right, so 87."
1215.96,2.8400000000001455, So let's say now we're not dealing with our base case.
1218.8000000000002,4.959999999999809, We're dealing with some number that's bigger than one of these base cases.
1223.76,2.8400000000001455, How do we think about this problem recursively?
1226.6000000000001,3.839999999999918," Well, there's three possibilities, right?"
1230.44,10.559999999999945," If I have a final score of 87, let's say that I think about the score of 86, right?"
1241.0,6.779999999999973," If I know all the possible ways I can make a score of 86, all I need to do is add one"
1247.78,1.6200000000001182," to that score, right?"
1249.4,3.839999999999918," It'll give me 87, right?"
1253.24,3.2000000000000455, So that's one possibility here.
1256.44,3.6799999999998363," But that's not the only possibility, right?"
1260.12,4.160000000000082, Because I could have a score of 85.
1264.28,4.2000000000000455," And if I add two to that 85, not two counts, right?"
1268.48,1.0, Just the score.
1269.48,5.440000000000055," If I have an original score of 85, if I just add two to that score, it gives me my desired"
1274.92,1.7200000000000273, score of 87.
1276.64,6.240000000000009," So if I know the possible combinations to make 85, then I know that all I need to do is"
1282.88,3.3599999999999," add two to my score, and that'll give me 87."
1286.24,9.0," And then the last possibility is to know all the possible ways to make 84, the score of 84,"
1295.24,4.119999999999891," is then I would just add a score, I would take that score and add a three to it to give"
1299.36,1.7600000000002183," me 87, right?"
1301.1200000000001,5.639999999999873, So I'm sort of using my base cases to guide my recursive step.
1306.76,6.839999999999918, So the number of ways I can make a score of 87 is the sum of all the possible ways I can
1313.6,5.920000000000073," make 86 or 85 or 84, right?"
1319.52,3.880000000000109," Because if I've made 86, I would just add one to it if I made 85, I add two to it, and"
1323.4,4.599999999999909," I made 84, I'd add three to the score."
1328.0,3.3200000000001637," So that's essentially what this recursive step is doing, right?"
1331.3200000000002,4.599999999999909," I've got, these are all the possible ways I can make a score of 87, you know, x minus"
1335.92,1.0," one, right?"
1336.92,2.2000000000000455," So 87, 86."
1339.1200000000001,2.2799999999999727," And that's just me calling my function, right?"
1341.4,3.6800000000000637," So score count x minus one, score count x."
1345.0800000000002,3.8799999999998818, Plus all the possible ways to make a score of x minus two.
1348.96,2.880000000000109, Plus all the possible ways to make a score of x minus three.
1351.84,5.480000000000018," So if I add all these three ways together, I would get all the possible ways I can make"
1357.32,1.6399999999998727, a score of x.
1358.9599999999998,4.080000000000155, Does that make sense?
1363.04,2.759999999999991, Okay.
1365.8,1.759999999999991," So that's it, right?"
1367.56,1.240000000000009, It's pretty clean code.
1368.8,1.8399999999999181, It looks really nice.
1370.6399999999999,3.7200000000000273," If we were to write this iteratively, it would be a mess."
1374.36,4.160000000000082, Because we probably have a whole bunch of nested loops to try to brute force all the possible
1378.52,3.240000000000009, combinations of scores that we can make.
1381.76,7.0," And it wouldn't look very, very nice, very pithonic."
1388.76,5.279999999999973," So let's do a trace of this code, just to bring it all together."
1394.04,2.759999999999991, The trace will be very similar to the Fibonacci trace.
1396.8,5.559999999999945," Except that now we have three paths to explore before having a return value, right?"
1402.36,5.0," So for a score of six, I would explore how can I make a score of five?"
1407.36,4.480000000000018," And of course, I will explore how can I make a score of four and three, but I'm not there"
1411.84,1.599999999999909," yet, right?"
1413.4399999999998,3.2799999999999727," First I need to explore how to make a score of five, which is a function call."
1416.7199999999998,3.800000000000182," This one will explore how to make a score of four, and of course a three and a two, but"
1420.52,1.599999999999909, not just yet.
1422.12,3.6800000000000637, A score of four will lead us to our base cases.
1425.8,3.240000000000009, It's just how to make a score of three and a two and a one.
1429.04,1.2799999999999727, These are base cases.
1430.32,3.0, They immediately return and we know how to make a score of four.
1433.32,3.4400000000000546," A score of three is also a base case, and a score of two is also a base case."
1436.76,4.3599999999999, So these ones will immediately return to give us the score of five.
1441.12,1.5200000000002092, So now we know how to make a score of five.
1442.64,4.679999999999836," We need to follow through how to make a score of four, which is just three and two and one."
1447.32,3.160000000000082," Oops, I should have changed that to be a one."
1450.48,4.720000000000027," And then how to make a score of three, and that's just a base case."
1455.2,4.599999999999909, So very similar trace as the Fibonacci code.
1459.8,3.3600000000001273, All right.
1463.16,2.7999999999999545, Questions about those examples?
1465.96,1.0, Are they okay?
1466.96,2.0, Do they make sense?
1468.96,2.119999999999891, Okay.
1471.08,3.880000000000109, So there is one exercise in the Python file.
1474.96,2.5599999999999454, It's for at home.
1477.52,2.9600000000000364, I would like you to try to memoize this code.
1480.48,7.160000000000082," So memoize means basically try to use a memo, a dictionary, to store values as you calculate"
1487.64,3.839999999999918," them, because you see that it's going to be just as inefficient as the Fibonacci code,"
1491.48,1.0, right?
1492.48,3.839999999999918," And then we have a calculator score of four again, where we had calculated it way back"
1496.32,1.9600000000000364," here, right?"
1498.28,8.680000000000064, And so try your hand at adding a dictionary to this code to try to speed it up.
1506.96,1.0, Okay.
1507.96,5.240000000000009," So the next, the second half of this lecture, we're now going to move away from recursion"
1513.2,4.920000000000073, on numbers and sort of having these nice mathematical operations that we can just
1518.1200000000001,2.0799999999999272, translate to code easily.
1520.2,5.160000000000082, And start looking at recursion on numerical things.
1525.3600000000001,1.7200000000000273, And we're just going to look at lists.
1527.0800000000002,6.199999999999818," But again, as I said, you can apply these very similar codes to any sequences of values,"
1533.28,3.8400000000001455, tuples or strings or things like that.
1537.1200000000001,3.839999999999918, So the reason why we're looking at lists is because lists are naturally recursive.
1540.96,6.160000000000082, So one of the motivations I gave at the end of last lecture is that we have lists that
1547.12,3.880000000000109," can have elements that are other lists, that can have elements that are other lists, that"
1551.0,1.959999999999809, can have elements as other lists.
1552.9599999999998,7.279999999999973," So without knowing sort of how deep these lists within lists go, it's going to be really"
1560.2399999999998,1.9200000000000728, hard to write iterative code.
1562.1599999999999,2.480000000000018," It's possible, but it's going to be really hard."
1564.6399999999999,4.720000000000027," And instead, we're going to see that the recursive version of this code is going to be a lot"
1569.36,6.519999999999982," more intuitive in the long run, maybe not right off the bat."
1575.88,5.920000000000073," But definitely, it's a lot easier to write and to read."
1581.8000000000002,5.319999999999936, So let's think about lists in a recursive way.
1587.1200000000001,4.519999999999982, So if we were doing iteratively what we'd say is we're going to loop through each element
1591.64,1.0799999999999272, and do something.
1592.72,4.360000000000127, The problem we're going to solve is figuring out the sum of all the elements in the list
1597.0800000000002,1.3199999999999363, to begin with.
1598.4,4.720000000000027," So iteratively, we just said, right, we loop over each element in the list and keep it"
1603.1200000000001,1.0, in our result.
1604.12,4.440000000000055," I've got these state variables I talked about last time, right, result in e that keep"
1608.56,4.639999999999873, track of which element we're at and what the value is.
1613.1999999999998,5.0," Recursively, remember, we're going to make all these function calls until we get to a"
1618.1999999999998,5.680000000000064," base case, at which point we're going to start to build up our result."
1623.8799999999999,4.559999999999945, So how can we think about this list recursively?
1628.4399999999998,5.080000000000155," Well, let's say that we have a list and we want to find the sum of all its elements."
1633.52,3.3599999999999, That's our original problem.
1636.8799999999999,6.6400000000001," Now let's say that we take the first element and we just extract it out, right?"
1643.52,2.599999999999909, We know we have this list with a bunch of elements.
1646.12,1.240000000000009, Let's take the first one.
1647.36,2.519999999999982, We know it's a 10.
1649.8799999999999,3.0, And then let's consider the remaining elements.
1652.8799999999999,9.440000000000055," So the 20 onward, if I take my 10."
1662.32,6.119999999999891," And I know the answer to the sum of all the elements in 20 onward, right?"
1668.4399999999998,4.120000000000118," Then all I need to do to figure out the sum of my original list, right?"
1672.56,8.559999999999945, This one here is to say it's the 10 plus the sum of whatever the sum of the 20 onward is.
1681.12,5.120000000000118," Now the sum for elements 20 onward is the same problem again, right?"
1686.24,3.599999999999909, It's the problem of finding the sum of all the elements in a list.
1689.84,5.920000000000073, It just so happens that our list is now our original list without that first element in it.
1697.04,2.0799999999999272," Does everyone understand that, right?"
1699.12,3.400000000000091," We've got our original problem and we've just made the same problem again,"
1702.52,2.0799999999999272, just a slightly different version of it.
1704.6,2.7200000000000273, All the lists except for that first element.
1707.32,2.3599999999999," So now we do the same thing, right?"
1709.6799999999998,2.160000000000082, Let's say this is our new list.
1711.84,5.519999999999982, We extract the first element from it and we consider the elements except for
1717.36,2.519999999999982, that first one as a new list.
1719.8799999999999,4.279999999999973," And again, if I knew what the sum of 30 all the way on to 60 was,"
1724.1599999999999,5.720000000000027, all I need to do is add it to the 20 that I extracted and I would know the sum of this list.
1729.8799999999999,1.2799999999999727," So we keep doing that, right?"
1731.1599999999999,6.400000000000091," We take our list, extract the 30 and consider the remaining elements as a list."
1737.56,0.8799999999998818, Same deal.
1738.4399999999998,2.759999999999991," If I knew what 40 plus 50 plus 60 was, right?"
1741.1999999999998,4.6400000000001," The sum of all the elements in this list, I'd just add it to the 30 and I have the answer to that problem."
1746.8,4.279999999999973," And we keep doing this, extracting an element and considering the remaining lists,"
1751.08,4.519999999999982, all the way down to when we have a list with just one element in it.
1755.6,2.6800000000000637," Well, this is a pretty simple problem to solve."
1758.28,3.9600000000000364," If I have a list with one element in it, the sum of the elements within that list"
1762.24,2.0," is just the value of that element, right?"
1764.24,1.5199999999999818, It's just 60.
1765.76,4.119999999999891," So a very simple problem, no need to keep sort of going further,"
1769.8799999999999,2.0, dividing this problem into smaller pieces.
1771.8799999999999,1.3199999999999363, I already know the answer to this one.
1773.1999999999998,0.7200000000000273, It's very simple.
1774.88,7.960000000000036, So this is our base case and we know the sum of the elements in a list with length one is that element.
1784.0800000000002,4.079999999999927," So once we reach the base case, we build back up our result, right?"
1788.16,5.240000000000009, We take the 60 and we had extracted the 50 originally.
1793.4,5.920000000000073," So we're going to pass the sum back up to whoever called it, which was the function that extracted the 50."
1799.3200000000002,2.599999999999909, So now the 50 plus the 60 is 110.
1801.92,3.0, Now this 110 gets passed back up the chain.
1804.92,6.880000000000109," When we extracted the 40, we said what I'm going to add the 40 to the sum of the 50 and the 60, 110, which is 150."
1811.8000000000002,1.7999999999999545, Pass that answer back up the chain.
1813.6000000000001,5.240000000000009," When I extracted the 30, I said I was just going to add the 30 with the sum of the remaining things,"
1818.8400000000001,2.3599999999999, which I figured out is 150.
1821.2,0.9600000000000364," The 20, right?"
1822.16,4.279999999999973," I had extracted it, becomes 20 plus the sum of everybody else, which is 180."
1826.44,6.480000000000018," So the sum is 200 and then finally my original question was to extract the 10, add it to everything else,"
1832.92,1.8799999999998818, which is the 200 that we figured out.
1834.8,1.240000000000009, So the full sum is 210.
1838.76,0.8400000000001455, Does that make sense?
1839.6000000000001,0.9199999999998454, This animation.
1840.52,1.0, OK.
1841.52,4.880000000000109," So we've got the division, all the way down to the base case and building back up the result."
1846.4,1.3999999999998636, So let's try to write it.
1847.8,2.520000000000209, So we're going to write it in pieces.
1850.3200000000002,2.2799999999999727, So the function is called total recur.
1852.6000000000001,1.1599999999998545, It takes an List L.
1853.76,4.279999999999973, So we're going to recursively figure out the sum of all the elements in this list.
1858.04,2.7200000000000273, So we can have a base case when the list is empty.
1860.76,2.6400000000001, We can return 0 up to you.
1863.4,6.879999999999882," Another base case, which is the one that I illustrated on the previous slide, is when the length of the list is 1."
1870.28,3.160000000000082," So when the length of the list is 1, what's the sum going to be?"
1873.44,1.0799999999999272, No need for recursion.
1874.52,2.0399999999999636, It's just that element.
1876.56,5.279999999999973," And so in these slides, what I've also included, in addition to the code, is an a little example."
1881.84,3.0, So it helps you think about what the function returns.
1884.84,4.559999999999945," So in this base case, when the length of the list is 1, the list would look something like this."
1889.3999999999999,3.759999999999991, And all I need to do is return L at index 0.
1893.1599999999999,0.7999999999999545, So the 50.
1893.9599999999998,1.7600000000002183, And that's my sum.
1895.72,0.23999999999978172, OK.
1895.9599999999998,3.6400000000001," And that's what I'm doing here, returning L at index 0."
1899.6,1.1200000000001182, Cool.
1900.72,2.199999999999818," Now, the recursive step."
1902.9199999999998,3.400000000000091," Remember, in the recursive step, I extracted the first element."
1906.32,2.5599999999999454," And I said, let me save this first element."
1908.88,3.6400000000001, So here it is being saved as L at index 0.
1912.5200000000002,1.7199999999998, And I'm going to add it to something.
1914.24,4.800000000000182," So in this example here, I've got this list that's longer than 1."
1919.0400000000002,5.119999999999891," I'm extracting the 30, L at index 0, and I'm going to add it to something."
1924.16,14.319999999999936," Well, that's something, based on the previous slide, where I did the animation, is going to be us putting our trust in the fact that we write this function correctly."
1938.48,7.240000000000009, That something is going to be us figuring out what the sum is of 40 and 50.
1945.72,3.5599999999999454," It's the same problem we're trying to solve right now, the sum of 30, 40, 50."
1949.28,4.960000000000036," Except that now, I'm just going to take the sum of just the 40 and the 50."
1954.24,6.759999999999991," So that something becomes the same function we're writing right now, total recur."
1961.0,4.2000000000000455," Except that I'm not calling it on L, not the whole thing all over again."
1965.2,1.0, That would be bad.
1966.2,2.9200000000000728, But I'm going to call it on L from index 1 onward.
1969.1200000000001,4.3599999999999," So essentially, removing that first element."
1973.48,3.1200000000001182, Is everyone OK with that?
1976.6000000000001,2.0, OK?
1978.6000000000001,1.2799999999999727, So that's it.
1979.88,0.8799999999998818, That's the function.
1980.76,2.2799999999999727," Nothing else to write, no loop."
1983.04,5.160000000000082," We've basically written a function assuming that we wrote the function correctly, right?"
1988.2,5.160000000000082," Which is a very strange way to think about recursion, but that's essentially what it is."
1993.36,4.759999999999991," You're trusting yourself to write this function correctly, such that your recursive step"
1998.12,4.240000000000009, leads you to the base case so that you can build back up the result correctly.
2002.36,5.160000000000082, So there's a lot of trust involved in writing these functions recursive.
2007.52,1.240000000000009, OK.
2008.76,2.0, OK.
2010.76,3.2799999999999727," So I'm not going to go through the Python tutor, but you should definitely go through it"
2014.04,5.439999999999827," on your own as a practice for the quiz, things like that."
2019.4799999999998,2.2000000000000455, Let's have you write this then.
2021.68,4.2000000000000455, So it's going to be a slight modification to the code we just wrote.
2025.88,4.2000000000000455, So it's going to take in a list as its parameter.
2030.0800000000002,5.119999999999891," And instead of summing the elements in the list, like we did 10 plus 20 plus 30, whatever,"
2035.2,3.9600000000000364," I would like you to sum the lengths of the elements in the list, right?"
2039.16,4.240000000000009," So if I pass it in this function, it's going to sum the length of this 2 plus the length"
2043.4,4.440000000000055," of this 1 plus the length of this 5, 2 plus 1 plus 5."
2047.84,4.279999999999973, So it'll be a very slight modification to the code that we just looked at.
2052.12,3.6799999999998363," And here it is online, 70-ish."
2055.7999999999997,2.1600000000003092," So think about the base case, right?"
2057.96,3.1599999999998545," If you have a list with one element in it, what do you return?"
2061.12,3.2800000000002," And if you have a list with many elements, how can you put your trust in something that"
2064.4,5.239999999999782, you just wrote to help you get to the answer?
2069.64,1.0, All right.
2070.64,1.0799999999999272, What do you guys have for me?
2071.72,3.200000000000273, So let's start with the base case.
2074.92,3.9600000000000364," And if you're having trouble, I encourage you to just in a little comment, just write"
2078.88,3.2399999999997817," down sort of what that base case looks like, right?"
2082.12,1.3600000000001273, Like I did in the slides.
2083.48,2.1599999999998545," It looks like this, right?"
2085.64,3.600000000000364, So what would I return if I have a list with one element in it?
2089.2400000000002,1.0, Yeah.
2090.2400000000002,4.960000000000036," Yeah, exactly."
2095.2000000000003,2.4399999999996," So we would turn the length of that element, right?"
2097.64,3.7600000000002183," So the length of whatever this is, a, b, whatever."
2101.4,1.2399999999997817, Awesome.
2102.64,3.400000000000091, How do we do the recursive step?
2106.04,3.0, Yeah.
2109.04,7.079999999999927," Yes, exactly."
2116.12,5.559999999999945," Total, land, recur, width, what list?"
2121.68,1.0, Yep.
2122.68,3.6399999999998727, So we're going to extract that first one.
2126.32,7.039999999999964, So this will give us some of the links of everybody else.
2133.36,1.0, Exactly.
2134.36,5.760000000000218," So we also need to add it to, yeah, L, C, right?"
2140.1200000000003,3.8799999999996544, So it's fine to do it even before or after because we're just summing these two values.
2144.0,4.320000000000164, So does it matter if you're the order that you're summing them?
2148.32,2.400000000000091, So that's perfect.
2150.7200000000003,2.6799999999998363, Any questions about this code?
2153.4,2.0, Yes.
2155.4,1.0, Sorry.
2156.4,6.0," In terms of the variable creation, that's not really function."
2162.4,4.559999999999945," You see, one or this is the function that's doing this function."
2166.96,1.0, Then doing the what?
2167.96,2.7200000000002547, That's classic words.
2170.6800000000003,9.0," So in terms of efficiency, recursive, this function will be slightly less efficient, I"
2179.6800000000003,1.0, would say.
2180.6800000000003,1.0, Yeah.
2181.68,5.8400000000001455, Because there's a little overhead in actually making a function call.
2187.52,4.359999999999673," Whereas if you use a built-in operator, it's been optimized to work pretty fast."
2191.8799999999997,1.0, Yeah.
2192.8799999999997,10.519999999999982," And when it's doing plus equals, it's definitely not doing this in the background, exactly."
2203.3999999999996,6.800000000000182," But this is just, I mean, we're, I'm trying to show you recursion on something that, you"
2210.2,5.679999999999836, wouldn't typically use recursion on just to help illustrate the idea of recursion.
2215.8799999999997,4.880000000000109," Certainly, you can use an iterative algorithm, obviously, to calculate the sum of these elements."
2220.7599999999998,6.480000000000018," And it's more intuitive, more in line with what we've been learning so far."
2227.24,1.0, Okay.
2228.24,3.7200000000002547, Excellent.
2231.96,5.919999999999618, So now let's look at a slightly different problem.
2237.88,5.119999999999891," So instead of finding the sum of all the elements in a list, let's tackle the problem of looking"
2243.0,1.9600000000000364, for an element in a list.
2244.96,4.119999999999891," Completely different, but we're still doing some sort of list operations."
2249.08,3.5600000000004, We're going to start with an implementation that's not quite right.
2252.6400000000003,2.199999999999818, And we'll see why in a little bit.
2254.84,3.800000000000182, So let's follow the same sort of pattern that we've seen in the previous one.
2258.6400000000003,4.119999999999891, So let's consider a list of length one.
2262.76,4.880000000000109," In this particular case, if I have a list with only one element in it, how do I know"
2267.64,2.6799999999998363, if that element is the one I'm looking for?
2270.3199999999997,3.600000000000364," Well, I'm just going to return this Boolean, right?"
2273.92,4.079999999999927," Whether L at index zero, that element is the one I'm looking for, the E."
2278.0,5.559999999999945, So notice this in list is passing in the list itself and the element I'm looking for.
2283.56,1.2399999999997817, Okay.
2284.7999999999997,3.0, I think.
2287.7999999999997,3.0, Okay.
2290.7999999999997,6.200000000000273, So then let's look at the recursive step.
2297.0,5.519999999999982," The recursive step, in this particular case, let's say it says, well, else, right?"
2302.52,4.920000000000073," We might think to say, well, if it's not the one I'm looking for, then let's look in"
2307.44,2.0399999999999636, the remainder of the list.
2309.48,4.7599999999997635," So like we did in the previous case, let's apply the same function we're writing right"
2314.24,4.160000000000309," now to all the elements except for the first one, right?"
2318.4,5.239999999999782, And we're still looking for element E in those remaining elements.
2323.64,2.0, Okay.
2325.64,4.320000000000164," So we can test it out and if we actually run it again, please I encourage you to do Python"
2329.96,7.679999999999836," 2 to run your own, but we can test it out and say, if we in this particular case, 2581,"
2337.64,2.6399999999998727," if I actually run this code, it will give me true."
2340.2799999999997,6.2800000000002," So it found the one inside the list 2581, which is good, right?"
2346.56,2.6799999999998363, It's exactly what we wanted.
2349.24,3.2800000000002," But if I change my input list slightly, right?"
2352.52,4.8400000000001455," And I've got 2158, the element I'm looking for is here."
2357.36,4.119999999999891," The code will actually give me false, the one that I just wrote, which is not okay, right?"
2361.48,4.599999999999909, I see the one is right over there.
2366.08,2.2800000000002, And so what exactly is going on?
2368.36,5.239999999999782, So we can run the code here.
2373.6,3.4400000000000546, So this is this code here.
2377.04,3.0," If you see that it gives you the incorrect value, one thing you could do when you're doing"
2380.04,5.440000000000055," recursion is to put a print statement within the function itself, right?"
2385.48,5.639999999999873, So we can print maybe the list we're currently at and the element we're looking for and
2391.12,1.5599999999999454, see exactly what's going on.
2392.68,6.400000000000091," So if I run it, it will say, well, first time through the function call, I'm looking for"
2399.08,2.199999999999818, the number one in this list.
2401.2799999999997,4.200000000000273," The next time I'm looking for the one in this list, the next time I'm looking for the"
