start,duration,text
0.0,19.080000000000002," Let's get started, everybody."
19.080000000000002,4.799999999999997, So last lecture we began talking about this topic of recursion.
23.88,6.879999999999999, And it hopefully solidified a few sort of really fundamental ideas about recursion that
30.759999999999998,3.1199999999999974, we're going to use in today's lecture.
33.879999999999995,6.760000000000005," Today's lecture, the first half of it ish, we're going to talk about recursion just kind"
40.64,3.480000000000004, of to review on some actual numerical examples.
44.120000000000005,4.239999999999995," But then the second half, which is the main event for today, is going to be recursion on"
48.36,1.0, non-numeric.
49.36,2.5600000000000023, So specifically recursion on lists.
51.92,4.520000000000003, But the techniques we'll see on lists can be applied to other things that are non-numeric
56.440000000000005,3.559999999999995," as well, like two pulls or strings or things like that."
60.0,4.840000000000003, So let's start the review of a little bit of review of what we talked about last time
64.84,2.5999999999999943, in some of the big ideas by looking at this example.
67.44,4.480000000000004, So we're going to write a recursive function for the Fibonacci sequence.
71.92,4.6000000000000085, And the Fibonacci sequence exists in nature in a lot of places.
76.52,8.280000000000001, One specific place is you can model a mating of rabbits using Fibonacci sequence.
84.8,1.7199999999999989, But we won't be setting that in depth today.
86.52,2.1599999999999966, We're just going to be looking at the sequence itself.
88.67999999999999,6.680000000000007," So just to remind you, the idea behind Fibonacci is we start out with two sort of basic values."
95.36,3.6400000000000006, Fibonacci of one is one and Fibonacci of two is one.
99.0,3.5999999999999943," So in my table here, I've got these two starting values."
102.6,4.840000000000003, And we can fill in the remainder of the table by basically saying Fibonacci of n is Fibonacci
107.44,3.280000000000001, of n minus 1 plus Fibonacci of n minus 2.
110.72,2.3599999999999994, So Fibonacci of three will be 1 plus 1.
113.08,2.0799999999999983, Fibonacci of four will be 2 plus 1.
115.16,1.7999999999999972, Fibonacci of five is 3 plus 2.
116.96,2.1200000000000045, Fibonacci of six is 5 plus 3.
119.08,2.1599999999999966, And Fibonacci of seven is 8 plus 5.
121.24,4.3999999999999915, That's the sequence we all know and love.
125.63999999999999,5.240000000000009," So our two base cases, if we're going to put this in mathematical terms, are Fibonacci"
130.88,3.0, of one is one. Fibonacci of two is one.
133.88,7.560000000000002," And our recursive step, in terms of the math and sash programming, Lingo is going to be"
141.44,5.560000000000002, the Fibonacci of n is equal to Fibonacci of n minus 1 plus Fibonacci of n minus 2.
147.0,2.1999999999999886, So we put that in our function.
149.2,5.240000000000009, So we slap a definition around that code and turn it into a nice function that we can
154.44,0.7599999999999909, run.
155.2,3.4399999999999977," If x is 1 or x is 2, those are our two base cases."
158.64,4.8799999999999955," Because we just return 1 right off the bat, nothing to call, no functions to call."
163.51999999999998,1.4800000000000182, There are base cases.
165.0,3.839999999999975," But otherwise, we're going to return a value."
168.83999999999997,5.1200000000000045, And the thing we're going to return is a call to Fibonacci of n minus 1 plus Fibonacci
173.95999999999998,5.319999999999993," of n minus 2, just like the mathematical definition said to do."
179.27999999999997,3.5200000000000102," So this is different than what we saw last lecture, last lecture, and our recursive"
182.79999999999998,1.0, step.
183.79999999999998,3.1599999999999966, We had basically just one function called to ourselves.
186.96,5.560000000000002," So whatever function we had to find up here, we only had return some variation of that"
192.52,4.52000000000001," function down here with something else tacked onto it, like an addition of some value"
197.04000000000002,1.5199999999999818, or something else.
198.56,4.840000000000003," In this case, we actually have the function being called twice."
203.4,6.039999999999992, So we're going to see what implications this has as we trace through the code.
209.44,3.960000000000008," And so as I trace through the code, I'll remind you of some of the big ideas that we"
213.4,2.719999999999999, learned last lecture.
216.12,3.759999999999991, So let's say that we wanted to calculate Fibonacci of 6.
219.88,6.200000000000017, And so I'm going to illustrate a function call just by the name of the function with the
226.08,2.1599999999999966, parameter that I'm calling.
228.24,5.1200000000000045, So one of the big ideas from last lecture was that when you make a function call that
233.36,5.239999999999981," to a function that's recursive, you're going to trace through that function call and then"
238.6,3.0400000000000205, environment for that function just as you normally would.
241.64,5.039999999999992," But as soon as you see another function call, so in this case, Fibonacci of 6 doesn't enter"
246.67999999999998,4.1200000000000045," the base cases, it goes up into the recursive step."
250.79999999999998,6.320000000000022," And it says, I'm going to calculate Fibonacci of x minus 1 plus Fibonacci of x minus 2."
257.12,6.0," So for this Fibonacci of 6 function call, let's follow along and say, well, Fibonacci"
263.12,6.8799999999999955," of 6, I want to calculate Fibonacci of 5."
270.0,7.0," Is it, this is my question to you, is it going to now calculate Fibonacci of 4?"
277.0,5.0," No, very good."
282.0,5.399999999999977," Because Fibonacci of 5 is a function call, right, we need to explore what this function will"
287.4,6.560000000000002," return before Fibonacci of 6 can add the result of this, the return of this, to Fibonacci"
293.96,2.2000000000000455, of 4.
296.16,7.1200000000000045, So that means this new Fib 5 is an entirely new environment calling Fibonacci with n is
303.28000000000003,4.240000000000009," equal to 5, completely separate than our original Fibonacci of 6 call."
307.52000000000004,2.5600000000000023, So let's explore what Fibonacci of 5 is going to do.
310.08000000000004,3.8799999999999955," Well, in its function call, it's going to again go in the recursive step."
313.96000000000004,2.9599999999999795, It's going to figure out Fibonacci of 4.
316.92,3.0," And then it's going to pause there, right, because it needs to figure out what Fibonacci"
319.92,5.28000000000003," of 4 is before it finishes its other half, right, to do Fibonacci of 3."
325.2,4.519999999999982," So Fibonacci of 4 will now create a new environment, and now it has to explore its result of"
329.71999999999997,1.0, return.
330.71999999999997,4.640000000000043, So it figures out Fibonacci of 4 is again going into the recursive step to calculate Fibonacci
335.36,2.0, of 3 plus something.
337.36,3.4799999999999613," But we don't know what that something is yet, because we have to explore what Fibonacci"
340.84,1.6000000000000227," of 3 is, right?"
342.44,5.599999999999966," So already where 4 function calls deep, and we haven't really done any work that we"
348.03999999999996,3.7600000000000477," can see the result of, right, there's no values being passed back."
351.8,4.360000000000014, What we're doing is exploring this path down until we get to some sort of base case
356.16,8.0, that will kick off our sort of conquer step where we pass values back up the chain.
364.16,4.759999999999991, So Fibonacci of 3 again is going to look at Fibonacci of 2.
368.92,4.240000000000009," And finally, we've reached a base case."
373.16,2.519999999999982," So Fibonacci of 2 will immediately return, right?"
375.68,2.0, It doesn't make another function call.
377.68,7.680000000000007," So Fibonacci of 2 will return a value, and then Fibonacci of 3 in its function call has"
385.36,6.319999999999993," the result for Fibonacci of 2, and then it's going to do plus, that value plus Fibonacci"
391.68,1.0," of 1, right?"
392.68,1.3600000000000136, 3 minus 2.
394.04,1.5199999999999818, So that's this one here.
395.56,6.639999999999986," It can easily grab the, do that addition, and return the value back up to Fibonacci of"
402.2,1.0, 3.
403.2,6.8799999999999955," So Fibonacci of 3 has its first half ready, right?"
410.08,6.680000000000007," So Fibonacci of 4, sorry, so Fibonacci of 4 has its first half ready, Fibonacci of 3."
416.76,5.0400000000000205," So Fibonacci of 4 was trying to figure out what Fib 3 was, and it did, right?"
421.8,2.1999999999999886," It was Fib 2 plus Fib 1, too."
424.0,6.0," So now it has a value for its first half here, and it needs to add that value to Fibonacci"
430.0,3.7200000000000273," of 2, 4 minus 2."
433.72,5.0," So it will explore that path, that's a base case, so all it does is return the value immediately,"
438.72,6.479999999999961," and now Fibonacci of 4 has its value, whatever Fib 3 was, that we figured out, plus Fib"
445.2,1.6000000000000227, 2.
446.8,1.0, Okay.
447.8,7.319999999999993," Now Fib 4, we have a value for it when we called Fib 5, so Fib 5 is now halfway happy"
455.12,6.079999999999984," because it knows what Fib 4 is, but it needs to add that to Fib 3."
461.2,3.480000000000018," So Fib 5 is still halted, right?"
464.68,4.199999999999989," It can't return anything, because now it needs to explore what Fib 3 is."
468.88,8.400000000000034," Well, Fib 3 is going to be, do another function call, right?"
477.28000000000003,5.159999999999968," So it's going to call Fib 2 and Fib 1, which are two base cases, which easily return"
482.44,5.720000000000027," the value back up to Fib 3, and now Fib 5 is happy because it knows this value, and"
488.16,5.439999999999998," now it knows this value, it can add them together, and Fib 5 now has a value that it can keep"
493.6,1.1599999999999682, track of.
494.76,5.560000000000002," And now finally, Fib 6, we're not even close to being done, you guys, Fib 6 has a Fib"
500.32,5.079999999999984," 5 value, so it has half of the things it needs to figure out what Fib 6 is, because now"
505.4,2.640000000000043, it has to figure out what Fib 4 is.
508.04,3.519999999999982," And already you can tell what we're going to do next, we're going to start exploring"
511.56,2.2800000000000296, the exact same way like we did before.
513.84,5.1200000000000045," Fib 4 needs to calculate Fib 3, it can't do Fib 2 yet, because Fib 3 needs to calculate"
518.96,1.9599999999999227," Fib 2 and Fib 1, right?"
520.92,6.240000000000009," Pass back up the value, Fib 4 can now finish its job by calculating Fib 3 and Fib 2, pass"
527.16,6.639999999999986," up the value, and now finally, Fib 6 has its two halves here, Fib 5 and Fib 4, and it"
533.8,3.6400000000001, can add them together and return the value.
537.44,7.32000000000005," So a super inefficient algorithm, because there's a lot of sort of stuff going on, but"
544.7600000000001,3.3999999999999773," not much work being done until the end, right?"
548.1600000000001,4.0," We've got a bunch of base cases we get to, and then we can start building back up our"
552.1600000000001,1.3999999999999773, result.
553.5600000000001,4.840000000000032," And the reason why I say it's inefficient is because, well, we're exploring these paths,"
558.4000000000001,7.199999999999932," and as we go along the way, right, we figure out what Fib 3 is and what Fib 4 is, right?"
565.6,7.080000000000041," But then, when we explore the right half of Fib 6 over here, we're actually recalculating"
572.6800000000001,1.8799999999999955, these values all over again.
574.5600000000001,4.360000000000014," That's why I said we're not even halfway done, because when we got Fib 5, we had to explore"
578.9200000000001,7.719999999999914," Fib 4, and Fib 4, this branch down here is basically a copy of this one down here."
586.64,4.800000000000068, So there's a lot of work being done here where you just do the same thing over and over
591.44,1.3199999999999363, again.
592.76,5.279999999999973," And so that leads me to say, well, what if we didn't have to do all this work all over"
598.04,1.4800000000000182," again, right?"
599.52,5.440000000000055, If only there was some sort of data structure that we could use to keep track of things as
604.96,3.0399999999999636," we calculate them, right?"
608.0,2.7200000000000273, To basically map one thing to another.
610.72,5.839999999999918," So if we already calculated Fib 4 to be some value, why don't we just look it up?"
616.56,7.32000000000005," So anytime we use things like keeping track of and looking things up, that should ring"
623.88,3.839999999999918, a little bell that says dictionaries can help us do that.
627.7199999999999,4.82000000000005, And so what we can do is actually write a more efficient Fibonacci recursive Fibonacci
632.54,6.519999999999982," function that uses, it's still recursive, but it uses dictionaries to keep track of"
639.06,3.740000000000009, values as we calculate them.
642.8,6.559999999999945," And so this is the Fibonacci efficient function, so my name is Fib efficient."
649.3599999999999,4.32000000000005," Notice we're still calculating Fibonacci of some n, but we're going to pass in another"
653.68,2.159999999999968," parameter, a dictionary."
655.8399999999999,5.720000000000027, And this dictionary will keep track of the Fibonacci values as we calculate them.
661.56,5.159999999999968," So the key will be the n, and the value will be Fib of that n."
666.7199999999999,4.720000000000027, And so down here you can see we're going to initialize a dictionary that has Fib of
671.44,3.519999999999982," 1 maps to 1 and Fib of 2 maps to 1, right?"
674.96,3.6800000000000637, Those are our base cases.
678.6400000000001,5.959999999999923, So let's take a look at our Fibonacci recursive function now that uses dictionaries.
684.6,5.32000000000005, No longer do we need to think about the base cases as Fibonacci of 1 is this and Fibonacci
689.9200000000001,1.0799999999999272, of 2 is this.
691.0,5.440000000000055," Now all we need to do is say, well, let's look up the value in our dictionary."
696.44,2.240000000000009, That's what our base case will be.
698.68,4.8799999999999955," And we don't need to make a call to ourselves if the item is already in the dictionary, right?"
703.56,8.56000000000006, So we can just return the value associated with n in dictionary D if that n is already
712.12,1.7999999999999545, in the dictionary.
713.92,4.759999999999991, So our two base cases down here will initially be in our dictionary.
718.68,3.919999999999959," And as we figure out the values of Fibonacci, we'll add them to our dictionary."
722.5999999999999,3.2000000000000455, And that's exactly what the recursive step will do.
725.8,5.399999999999977," So else, the values not in our dictionary, so unfortunately we have to calculate it, right?"
731.1999999999999,1.0, Which is fine.
732.1999999999999,4.639999999999986, We'll basically do that the first time through that sort of exploring the left half of our
736.8399999999999,1.0, path.
737.8399999999999,3.0, But that's pretty much the only times that we're going to calculate it.
740.8399999999999,3.0, All the other times we'll just look it up.
743.8399999999999,4.960000000000036, So this is going to be a little different than what we've seen before because I'm not
748.8,4.759999999999991, right off the bat returning Fib and minus 1 plus Fib and minus 2.
753.56,5.7999999999999545," I'm actually still running the same recursive step, Fibonacci minus 1 plus Fib and minus"
759.3599999999999,2.3600000000000136," 2, but I'm saving it in a variable."
761.7199999999999,3.560000000000059, And that's totally fine to do.
765.28,4.159999999999968," And then before I actually return this value, let me add it to my dictionary."
769.4399999999999,5.840000000000032, So this is simply just saying this dictionary at this particular n for this particular function
775.28,2.480000000000018, is equal to this thing that I just calculated.
777.76,5.599999999999909, Just a straight up dictionary addition adding this item to the dictionary.
783.36,4.399999999999977," And then after I've added it to my dictionary, I can return that value."
787.76,6.680000000000064," So still passing it back up the chain of function calls, but we'll save it first."
794.44,2.1200000000000045, Everyone okay with this code?
796.5600000000001,1.0, Okay.
797.5600000000001,7.199999999999932, So then this is the dictionary I mentioned where we initialize our two base cases and then
804.76,1.5600000000000591, we can print the function.
806.32,5.079999999999927, So let's trace through the code to see what exactly happens with these function calls
811.4,1.0, now.
812.4,5.0," So we're going to initializing our dictionary where we have n1, Fibonacci of 1 is 1 and"
817.4,2.1200000000000045," n2, Fibonacci of 2 is 1, right?"
819.52,2.0399999999999636, Our base cases.
821.56,3.519999999999982," Fibonacci of 6 again, we're doing the same function calls, right?"
825.0799999999999,3.560000000000059, So that means there's nothing stored for Fib 5.
828.64,3.7200000000000273, So we still have to explore what value it will be.
832.36,4.759999999999991," Nothing stored for Fib 4, we're still exploring, nothing stored for Fib 3, we're still exploring."
837.12,1.7200000000000273, We've reached a base case.
838.84,4.8799999999999955, So now the first thing we do is check if it's in the dictionary.
843.72,3.32000000000005," It is, so we just return the one directly."
847.0400000000001,3.4799999999999045," Check if the other half is in the dictionary, return the one directly, and now we've got"
850.52,2.240000000000009, a value for Fib 3.
852.76,3.1200000000000045," Before returning it, let's store it in our dictionary."
855.88,2.480000000000018, So I just calculated what Fib 3 was.
858.36,6.920000000000073," Let's put it in, the key is 3 and Fib 3 is 2."
865.2800000000001,3.439999999999941," So far so good, it's pretty similar to what we've done before except that we're"
868.72,1.4800000000000182, storing this value in the dictionary.
870.2,3.3999999999999773," So now we explore the right half of this Fib 4, right?"
873.6,6.8799999999999955," Fib 3 plus Fib 2, it's already in the dictionary, so it immediately returns this addition."
880.48,3.7999999999999545," Now we know what Fib 4 is, so we add it to our dictionary."
884.28,3.2000000000000455, Fib 4 is 3.
887.48,2.0399999999999636," Explore the right part of Fib 5, right?"
889.52,4.1200000000000045," So Fib 4 plus Fib 3, do we go further now, right?"
893.64,2.1200000000000045," In the previous case, we explored 2 and 1."
895.76,2.400000000000091," In this case, do we keep exploring?"
898.16,4.919999999999959," No, exactly, because our base case says if 3 is already in the dictionary, simply return"
903.0799999999999,2.0, the value associated with it.
905.0799999999999,1.32000000000005," So yep, there it is right there."
906.4,1.3999999999999773, We added it a while ago.
907.8,5.440000000000055," We just returned the 2 immediately, no need to go down this path."
913.24,5.639999999999986," So now Fib 5 is done pretty quickly, so that means we have the value for Fib 5 and we"
918.88,1.759999999999991, add it to the dictionary.
920.64,2.519999999999982, We explore the right half of Fib 6.
923.16,3.480000000000018," Remember beforehand, I said we were not done."
926.64,4.639999999999986," We don't need to explore this Fib 4 anymore, because we added it to our dictionary long"
931.28,1.0, ago.
932.28,5.960000000000036, So now all we need to do is look up the value associated with 4 from our dictionary.
938.24,4.67999999999995," So boom, there it is, and then we can just add Fib 5 and Fib 4 together and get the value"
942.92,4.560000000000059," for Fib 6, store it in the dictionary, and in this case, it's the end."
947.48,6.319999999999936, We don't need to do anything else with this value passing it back or anything like that.
953.8,2.7200000000000273," So we're not recalculating anything else, right?"
956.52,3.32000000000005," We're just checking the dictionary and if need be, we calculated."
959.84,6.3599999999999," So it's an improvement, but how much of an improvement is it actually?"
966.1999999999999,4.400000000000091," So if we run this function, and it's in the Python code, you can play around with it"
970.6,6.1200000000000045," yourself, if you run the function that we originally wrote, Fib, the one where we don't"
976.72,7.279999999999973," store anything in dictionary, if we try to calculate Fib 5, not you of 34, it results"
984.0,4.240000000000009, in 11.5 million function calls.
988.24,6.039999999999964," That's a lot of function calls because even Fib 6 had Fib 3 being called twice, Fib"
994.28,5.1200000000000045," 4 being called three times, Fib 4 being called twice, things like that."
999.4,5.080000000000041, So can you imagine how many times Fib 3 will be called when we are trying to calculate
1004.48,1.0, Fib 34?
1005.48,4.0," Probably thousands, if not more."
1009.48,4.480000000000018," So overall, the number of function calls we're making is 11.5 million with our original"
1013.96,6.8799999999999955," code, but the efficient version only makes 65."
1020.84,5.280000000000086," It's not like we went from 11.5 million to like 2 million, right?"
1026.1200000000001,6.559999999999945," We went from the order of millions to tens, which is really, really impressive in terms"
1032.68,1.0, of speed.
1033.68,4.319999999999936," So if you try to run this program, it'll take a couple seconds for Fib 34, but the efficient"
1038.0,2.3600000000001273, one will be instant.
1040.36,3.160000000000082," And all of these function calls have some overhead, right?"
1043.52,3.759999999999991, You need to create an environment in Python and each to pass these parameters.
1047.28,5.319999999999936," So all of these function calls take a lot of time, whereas a dictionary lookup is basically"
1052.6,1.759999999999991," instantaneous, right?"
1054.36,6.240000000000009," So in this particular case, we've given up some of our memory to store values, right?"
1060.6,4.759999999999991," The dictionary is storing 34 entries, which is not much, but there are applications where"
1065.36,4.480000000000018," you can't spare 34 entries, right, in your memory."
1069.84,5.599999999999909," In which case, you might spare some time to continue calculating without taking up some"
1075.4399999999998,1.0, memory.
1076.4399999999998,2.560000000000173," So there's a little bit of trade-off between these two programs, right?"
1079.0,2.2799999999999727, One of them doesn't store anything but is slow.
1081.28,4.679999999999836," The other one stores things, but is fast."
1085.9599999999998,4.800000000000182, Let's look at one more example where we do Fibodachi on numerics.
1090.76,6.119999999999891," And this, I don't know when you'd use Fibodachi in your real life, but knowing all the possible"
1096.88,4.7999999999999545," ways, you can make a score of X, and basketball is a little bit more useful."
1101.68,3.0800000000001546, So let's think about this problem recursively.
1104.7600000000002,4.079999999999927," Certainly, we could do it iteratively and brute force our way through all the possible"
1108.8400000000001,2.519999999999982," combinations of scores, right?"
1111.3600000000001,4.039999999999964," So in basketball, you can make a basket that's worth 1.2 points or 3 points."
1115.4,6.880000000000109, So you can think about all the possible combinations you can make to give you some score of X.
1122.2800000000002,2.2799999999999727," We're going to think about this problem recursively, right?"
1124.56,4.400000000000091, So let's start with our base cases.
1128.96,2.9199999999998454," Base cases, we've got three of them."
1131.8799999999999,5.440000000000055," So if we think about a score of 1, so if X is equal to 1, so that means if we have a score"
1137.32,4.319999999999936," of 1 in basketball, what are all the possible ways we could have made a 1?"
1141.6399999999999,3.2000000000000455," Well, you could just score 1 point and then that's it, right?"
1144.84,5.120000000000118, I just did 1 plus C or just emphasized that we're just scoring 1 in the next.
1149.96,4.119999999999891," If we make a basket, that's worth 2 points, or if we have 2 points in basketball, what"
1154.08,2.6800000000000637, are all the possible ways we could have made 2?
1156.76,4.319999999999936," Well, we could have scored a 1 and a 1, or we could have just scored 2 right off the"
1161.08,1.0, bat.
1162.08,3.9600000000000364," So that's 2 possible ways to make a score of 2, right?"
1166.04,3.3999999999998636," And similarly, to make a score of 3, what are all the possible ways?"
1169.4399999999998,2.6000000000001364," Well, we could have scored a 1 than a 1 than a 1."
1172.04,3.599999999999909," We could have scored a 2 and a 1, or we could have scored a 3 right off the bat."
1175.6399999999999,6.960000000000036," So that's 3 different ways you can make a score of 3 in basketball, okay?"
1182.6,1.0799999999999272, Everyone with me so far.
1183.68,2.880000000000109," These are our base cases, okay?"
1186.5600000000002,3.3999999999998636," Because the recursive step will be very, will blow your minds."
1189.96,1.5199999999999818," It's so simple, okay?"
1191.48,5.880000000000109, So the recursive step looks like this.
1197.3600000000001,4.879999999999882," Now somebody give me, what's a reasonable basketball score?"
1202.24,1.7999999999999545," Like for our team, 87?"
1204.04,1.0, Okay.
1205.04,6.600000000000136," It's been probably 25 years since I've played pro basketball in grade 5, you guys."
1211.64,2.400000000000091, So I forgot what's a reasonable score.
