start,duration,text
2405.48,5.199999999999818," one in this list and the last time for my function call, I'm looking for the one in"
2410.68,3.2400000000002365, this list.
2413.92,7.1599999999998545," And already we see something went wrong because as I was looking through these lists, right,"
2421.08,5.639999999999873," I'm basically skipping over important elements, right?"
2426.72,6.2400000000002365, What this code is actually doing is only checking if the last element is the one you're looking
2432.96,1.0, for.
2433.96,1.0, Right?
2434.96,4.7199999999998," So basically ignores that first element in the code, right?"
2439.68,8.5600000000004," The code here, yes, it extracts that first element, but it doesn't do anything with it."
2448.2400000000002,2.5599999999999454, So that's our problem.
2450.8,3.9200000000000728, What we want to do is still look at further elements in the list.
2454.7200000000003,2.0799999999999272, So that part of the code is correct.
2456.8,2.8799999999996544, But we only want to do it in a certain situation.
2459.68,7.7199999999998," And that situation is when the element that we just extracted, L at index zero, is not"
2467.3999999999996,1.6000000000003638," the one we're looking for, right?"
2469.0,1.8799999999996544, That little else case.
2470.8799999999997,1.0, Right?
2471.8799999999997,4.600000000000364, So we still want to extract the first element if we have a list with more than one element
2476.48,1.4800000000000182, in it.
2477.96,4.399999999999636," But as we've extracted it, check if it's the one we're looking for."
2482.3599999999997,4.920000000000073," If it is return true, no need to keep searching the rest of the elements in the list."
2487.28,5.519999999999982," If it's not the one we're looking for, this else here, then we can look at the remaining"
2492.8,3.119999999999891," elements in the list and run the exact same function we're writing, right?"
2495.92,4.200000000000273, To check if the elements is in the remaining list.
2500.1200000000003,1.0, Does this code make sense?
2501.1200000000003,1.599999999999909, Is it all right?
2502.7200000000003,2.1599999999998545, Okay.
2504.88,6.2800000000002, So the way I wrote this code is sort of how I personally think about the problem.
2511.1600000000003,4.400000000000091," And if we run the code again, it'll give me the correct answers each time."
2515.56,4.1599999999998545, But I wanted to mention that we can actually clean up the code a little bit and write it
2519.72,4.360000000000127," a little bit more, um, pathetically."
2524.08,3.0799999999999272," So it's, you know, it's a little bit nicer to read."
2527.16,1.0, It's more cleaned up.
2528.16,5.440000000000055," But one of the things that was, um, confusing for me when I first started learning recursion"
2533.6,8.320000000000164," is that I would always see these beautiful, cleaned up versions of code that do the recursion."
2541.92,3.7600000000002183," And that's not sort of how we approach thinking about the problem, right?"
2545.6800000000003,3.919999999999618, I can't come up with this nice form right off the bat.
2549.6,3.9200000000000728," And this is one example, but there are certainly other examples of more complicated code where"
2553.52,2.1600000000003092," you see it and it's just, it looks beautiful."
2555.6800000000003,4.1599999999998545," And yes, if I look at it, I can figure it out and I say, okay, yeah, that makes sense."
2559.84,3.3600000000001273, But I personally could never come up with it on my own.
2563.2000000000003,1.4800000000000182," So I was, I was writing these lectures."
2564.6800000000003,2.7599999999997635," I thought, well, how do I actually think about the problem?"
2567.44,1.8800000000001091, So I just went back one slide.
2569.32,5.800000000000182," And the way I think about the problem is to kind of separate it into these smaller, a"
2575.1200000000003,3.6799999999998363," bunch of different base cases, right, or a bunch of different cases."
2578.8,3.0399999999999636, And so that's what I've been trying to do in this particular lecture to help you guys
2581.84,1.0, understand recursion.
2582.84,4.760000000000218," It's, you know, think about the case when we have a list with one element in it, right?"
2587.6000000000004,1.9599999999995816, How would you solve that problem?
2589.56,2.600000000000364, And then think about the case when you have a list with many elements in it.
2592.1600000000003,1.6399999999998727, How would you solve that problem?
2593.8,1.7599999999997635," Yes, it's true."
2595.56,3.400000000000091," There are some pieces here that are, that are repeating, right?"
2598.96,4.239999999999782, So we've got L at zero equal E is in a couple places.
2603.2,2.400000000000091," But you can do that clean up later, right?"
2605.6,5.360000000000127, So here I've got two test cases that return two cases that return L at zero so we can pop
2610.96,2.519999999999982, them into the same test case here.
2613.48,2.480000000000018, And then we can check if the length of the list is zero.
2615.96,3.7600000000002183," We can add that test case and else we check the remainder of the list, right?"
2619.7200000000003,1.0, That's totally fine.
2620.7200000000003,3.4799999999995634," And if it helps you think about the problem this way, that's okay."
2624.2,4.160000000000309," Two, but personally for me, it was a lot easier to think about the problem in terms of a"
2628.36,3.519999999999982, list with one element in it and then a list with many elements in it.
2631.88,7.039999999999964," And it's totally fine to write a little bit, quote unquote, inefficient looking code to"
2638.92,2.0, begin with.
2640.92,1.9200000000000728," Certainly don't hard code all the base cases, right?"
2642.84,4.7199999999998," If length is zero, do this, if length is one, do this, if length is two, do this, right?"
2647.56,3.2800000000002, But some reasonable base cases are okay to do.
2650.84,4.039999999999964, So this is just showing the simplified code.
2654.88,4.559999999999945, Another thing that I wanted to mention and hopefully you've noticed this already is the
2659.44,6.599999999999909," function that you're writing, all of the returns from this function need to have the same"
2666.04,2.2800000000002," type, right?"
2668.32,4.279999999999745," When we wrote, I'll go back a couple slides, when we wrote the function that calculated"
2672.6,5.360000000000127," the sum of all the elements in the list, so that's this one here."
2677.96,1.0, What were we returning?
2678.96,5.079999999999927, Here we were returning an actual number and then here we were assuming that this function
2684.04,4.400000000000091," returned an actual number that we can add to this actual number, right?"
2688.44,5.679999999999836, So every single return statement needs to return the same type of object.
2694.12,5.440000000000055," Because if you don't, if you're assuming that the base case returns a list, but then at"
2699.56,6.1599999999998545," some point in the code, you're going to be working with a number or a Boolean, then Python"
2705.72,3.080000000000382," as soon as it gets that base case is going to say, hey, you're trying to add a Boolean"
2708.8,1.0, to a list.
2709.8,1.0, What's up?
2710.8,1.0, Right?
2712.2000000000003,6.039999999999964," So in the summing of the list elements, all the test cases returned a number and in this"
2718.2400000000002,4.960000000000036," case where we are trying to return the, whether the element is in the list or not, notice"
2723.2000000000003,3.7199999999998, every single one of my returns is going to return a Boolean.
2726.92,4.8400000000001455," So here, Boolean, here, Boolean, and here in the recursive step, I'm assuming that"
2731.76,4.0, I'm just passing this Boolean back up the chain of command.
2735.76,1.8800000000001091," So a very, very important thing."
2737.64,4.1599999999998545, Something that was not made clear to me when I first started recursion.
2741.7999999999997,7.160000000000309," But once I knew this, it just made so much more sense and it helped me write my code better,"
2748.96,3.0399999999999636, more perfectly right off the bat.
2752.0,1.9600000000000364, Let's look at a slightly different example now.
2753.96,3.399999999999636, So we've looked at taking the sum of all the elements in the list.
2757.3599999999997,2.6400000000003274, We've looked at figuring out whether an element is in the list.
2760.0,3.119999999999891, Let's do something completely different.
2763.12,1.5199999999999818, So we're working with lists.
2764.64,4.039999999999964, Let's say that we now have an input list that looks like this.
2768.68,1.5599999999999454, So we've got a list.
2770.24,4.079999999999927, This is my list beginning an end.
2774.3199999999997,3.9200000000000728, And this list only has list elements within it.
2778.24,3.480000000000018," So no integers, but its elements are lists."
2781.72,1.6399999999998727, So here's one list element.
2783.3599999999997,3.7600000000002183," Here's another list element, and here's another list element."
2787.12,1.0, Right?
2788.12,4.960000000000036," So in this example, I've got a list with three list elements."
2793.08,6.239999999999782," What I'd like to do is to flatten this list, which means that I want to remove any semblance"
2799.3199999999997,11.16000000000031, of sublists and take just all the elements of the sublists and put them top level.
2810.48,3.2399999999997817, Does this task make sense?
2813.72,1.0, Okay.
2814.72,2.6400000000003274, So I'm not assuming I've got lists within lists within lists.
2817.36,4.7199999999998, I'm just assuming I've got lists with list elements that have integers or whatever.
2823.08,1.0, Okay.
2824.08,4.599999999999909," So again, let's think about the base case."
2828.68,3.400000000000091, Let's think about the case when we have a list with one element in it.
2832.08,3.0, And then we can figure out the recursive step.
2835.08,5.0," So if I have a list with one element in it, again, I've got an example here on the right hand side."
2840.08,4.0," It's a list, right, with one list element in it."
2844.08,3.0, That's why I've got the double square brackets.
2847.08,4.0," If I wanted to flatten this, what could I do?"
2852.08,3.0," I could just grab the element at index zero, right?"
2855.08,8.0," Because the element at index zero is this inner list, and it is a flattened version of my list."
2863.08,2.0, Okay.
2867.08,2.0," Else, what am I going to do?"
2869.08,4.0," Well, let's do the same pattern. It seems to have worked so far for us."
2873.08,3.0, Let's do the pattern of extracting that first element.
2876.08,3.0, So grab element at index zero.
2879.08,5.0," So here we would grab something like square brackets, one comma two,"
2884.08,4.0, and concatenate it with something.
2888.08,3.0," Okay. Remember when we concatenate a list with another list,"
2891.08,3.0, it gives us a big list with all the elements in it.
2894.08,4.0," Exactly what we're looking for, right, when we want a flattened list."
2898.08,6.0," So the something we're going to add this, uh, L at index zero with is,"
2904.08,4.0, just us flattening the remainder of our list.
2908.08,4.0," Again, same pattern we've been seeing already, right?"
2912.08,4.0," So if I extract, in this example, here, the one comma two as a list,"
2916.08,4.0," I'm going to concatenate it with the assumption that,"
2920.08,6.0, the function I'm writing will work correctly to flatten three comma four and nine comma eight comma seven.
2926.08,7.0," Right. So if I flatten that, um, this will give me just a list with three, four, nine, eight, seven, all in it."
2933.08,3.0," Okay. And if I concatenate one comma two with three, four, nine, eight, seven,"
2936.08,5.0," that just gives me three, four, nine, eight, seven."
2941.08,2.0," Everyone with me, is that all right?"
2943.08,3.0," Okay, good. I see some nods, so that's actually a pretty good sign."
2946.08,3.0, Okay.
2949.08,2.0," Okay. You are with me, right?"
2951.08,3.0, Because now it is your turn.
2954.08,7.0, So we're going to write a variation of whether an element is in a list.
2962.08,4.0, So I'm going to give you a very similar scenario to this flatten one.
2966.08,4.0, So I'm going to give you a list that contains list elements.
2970.08,4.0, So here's my list that contains list elements in it.
2974.08,6.0," And what I'd like you to do is write a recursive function that checks whether this element,"
2980.08,7.0," whatever the second parameter of the function, in my function call, is in these list elements."
2987.08,6.0," So not at the top level, like we wrote last, the last code to check if an element is in the list."
2993.08,3.0, But in these sub lists.
2996.08,7.0," So just to show you kind of the difference, if I check whether three is in one comma two comma three,"
3003.08,7.0," that will be true. But if I check whether three is in, you know, the list containing the list one comma two comma three,"
3010.08,5.0, that's false because it's checking whether the three is equal to this list.
3015.08,5.0, So let's just doing a top level equality here.
3020.08,9.0, So let's have you write this code down online 166.
3029.08,6.0, You may use the in operator to check if an element is in a list itself.
3035.08,4.0," But obviously you won't be able to use the in operator, nor should you,"
3039.08,6.0," or not writing a recursive function to check if the element is within a list, uh, list element."
3045.08,8.0," So, um, have you worked on it for a couple minutes and, and then we can write it together."
3053.08,2.0, All right. Does anyone have a start?
3055.08,4.0, So let's look at the case where we have one element in it.
3059.08,9.0," How do you, um, check whether that element is within the, the list inside."
3068.08,14.0," So if, right, this is our, our case with one element in it, the length of L, um, equi equals one."
3082.08,9.0, Yeah.
3091.08,8.0," Yeah, exactly. E and, E and L is, is, is the correct, um, thing to do L at index zero, right?"
3099.08,4.0," So if, if this is our L, that's why I added this little example here so it can help us."
3103.08,3.0, So L at index zero is this guy here.
3106.08,5.0," And all I need to do is check if E is in L at index zero, right?"
3111.08,3.0, And I can just return that right off the bat.
3114.08,4.0, Right.
3118.08,11.0," I could do if E in L zero return true, L's return false, but E in L zero is already a Boolean, so I can just return that directly."
3129.08,8.0," Okay. L's, we have a list, uh, with more than one element in it, right?"
3137.08,3.0, So what do we do here?
3140.08,11.0," Remember, extract the first element and then, you know, do the rest."
3151.08,4.0," So let's say this, let's say the first element is L at index zero, right?"
3155.08,5.0, That'll help us think about it a little bit.
3160.08,10.0," So before looking at the remainder of the list, right, and calling our recursive function, what did we do when we checked if an element was in the list when we just had a plain list?"
3170.08,16.0," We just said if, you know, um, E is in first, return true, L's return false, right?"
3186.08,7.0, But we don't want to do else return false because that's not quite true.
3193.08,6.0," Else, we want to look at the remainder of the list, right?"
3199.08,7.0," We want to see if the element, obviously, if the element is not in the first thing that I just extracted, right?"
3206.08,9.0," This list here, then I would like to say is it in the rest of this list, right?"
3215.08,4.0, Which is us calling the function that we're just writing all over again.
3219.08,12.0," So we can return the name of this function in lists of, what did I call it, lists of lists."
3231.08,9.0, And then L from one onward with the same element we're trying to find.
3240.08,18.0," And of course, we can simplify this just like we could simplify the previous one, but it helps to think about it in these two cases, a list with one element and a list with many elements."
3258.08,11.0, Any questions about this? Yes.
3269.08,7.0, This one? This one we're considering a list with one list inside it.
3276.08,4.0, Yeah.
3280.08,5.0," We could include another base case, I suppose, if the length of L is zero return false, that would also work."
3285.08,5.0," Because obviously if the list is empty, then there's, it's not in there."
3290.08,8.0," Okay, so when do we use recursion? Obviously, a lot of the examples we've seen here, we, they're very intuitive to write iteratively, right?"
3298.08,7.0, But I mentioned a couple examples last time where it's more intuitive to use recursion.
3305.08,8.0," And specifically, I wanted to draw a little bit of a parallel to this thing when we learned about while loops, right?"
3313.08,5.0," We said, well, what if we tried to code a little game that just used if and else's?"
3318.08,6.0," I said that we would have a bunch of nested if else statements, right, without a while loop."
3324.08,6.0," Because we don't know how deep to make these if else, if statements."
3330.08,5.0, And so very similar idea exists with recursion and when to use recursion.
3335.08,13.0," So if I had a list where the whole bunch of lists in it and those lists could have lists within it and so on and so on, I don't know how long I need to, how deep I need to make my code go, right?"
3348.08,5.0," So an example using a for loop would be to say for each element in L, right?"
3353.08,6.0," I'm going to say I'm going to look at each element, I'm going to say, well, if you're not a list, then I can deal with you directly."
3359.08,10.0," But if you are a list, then I need to iterate over you. And so I've got this other iteration here for each j and I, right, from one of those lists."
3369.08,7.0," Again, I would say, are you a list? If not, I'll deal with you directly. Else, you are a list. So I do need to iterate over you."
3376.08,12.0," And you can see this nested idea that now comes into play here. And of course, we could try to use a while loop to optimize the code a little bit, say, you know, while this element type is not a list, do this, you know, things like that."
3388.08,10.0," But it leads to some reliever, both and verbose code. And so recursion is a way for us to deal with these lists within lists within lists."
3398.08,11.0," And of course, when you have data structures that you don't know how long, how deep they go. So I mentioned file systems and a set of operations last lecture has really nice places to use recursion."
3409.08,12.0," Scooby Doo gang looking for, you know, their culprit rooms that have doors that lead to other rooms that have doors lead to other rooms. They don't know how many doors they need to go through to get to a room without doors."
3421.08,7.0," Obviously recursion, they should use. And then a bunch of other fun examples of places to use recursion."
3428.08,13.0," So the last bit of class, I would like to work through this example where we're going to see the code to solve lists within lists within lists within lists."
3441.08,8.0," Okay. But before we do that, we're going to talk about, so we're going to do that example in the context of reversing a list."
3449.08,7.0," But before we look at a list that has all these different sub lists within it, let's look at a list that has just integers."
3456.08,6.0, How would we think about this problem recursively to reverse all the elements in this list?
3462.08,8.0," Okay. So again, we're going to use the very same pattern we've been using all throughout today when we've been dealing with lists."
3470.08,12.0," We're going to take out the first element, extract it, and we're going to deal with the remainder of the list, basically by writing, running the same function we're writing on the remainder of the list."
3482.08,7.0," So let's say I have my original list and I look at my first element, just like before, I'm going to extract it out."
3489.08,20.0," If I take this first element and I pop it at the end, and then I consider the remainder list, right, everything except for that first element that I put at the end, I can just call the same function I'm writing right now to reverse the remaining list."
3509.08,9.0," Which means that I'm going to take this remaining list, grab the first element, pop it at the end, and deal with the remaining list."
3518.08,7.0," Again, take the first element, pop it at the end, deal with the remaining list, until I have a list with length 1."
3525.08,11.0," How do I ever reverse a list that only has one element in it? It's just that list, right, I just, you know, reversing a list L is just L."
3536.08,14.0," Okay, good. So that's the idea. And notice that when we're building back up the result, we took that first element and we tacked it onto the end."
3550.08,12.0," So we're going to do another list concatenation kind of deal, except that the thing that I'm concatenating now, the first element will be at the end, right, that it'll be the second part of my plus."
3562.08,3.0," Okay, so I'm just giving you a heads up. That's what it will look like."
3565.08,12.0," So let's write the code. If the length of the list is 1, right, if I'm reversing a list with one element in it, just return that list. Easy peasy, right? It's just the list itself."
3577.08,14.0," Okay, L's. And this is where the fun comes in, right? I've got something, so I'm going to do something concatenated with something else."
3591.08,8.0," So I'm extracting the first element. There it is, L at index zero, but it's sitting somewhere funny that we haven't seen it sit before."
3599.08,10.0," It's sitting on the second, you know, to the right of the concatenation. And that's fine because what we want to do is take the element from the first, the beginning of the list and tack it onto the end."
3609.08,6.0, Right? And there's something else that's funny about it. I've put it in square brackets.
3616.08,7.0," Okay, now I, again, I'm including this example to help us think about it. Why are those square brackets there?"
3623.08,11.0," Think about what we want this function to return. Is it returning a number? No, is it returning a Boolean? No, it's returning a list, right?"
3634.08,8.0," This function I want to take in a list and give me back a list, but where my elements are in reverse order."
3642.08,9.0," So what I want to do, right, you can already see this return over here is returning a list, right? So it'll be square brackets, 10, or whatever."
3651.08,15.0," In my recursive step, if I'm concatenating, I want to concatenate this thing here, which I'll tell you about in the next slide, but I'm going to concatenate it with, it's going to be a list with some other list, right?"
3666.08,11.0," If I concatenate a list with a number, that L at zero is, L at zero is a 10, right? So if I concatenate a list with a number, Python will yell at me."
3677.08,12.0," So what I need to do is make that number that I just extracted L at zero be a list. So I'm just going to slap a square bracket around it and say, hey, Python, this is a list with one element in it."
3689.08,17.0," Does that make sense? Cool. So then what that means is I've got this 10 that I extracted, I'm going to concatenate something with that 10, and that something is me putting my trust into the function I'm writing to say that something is going to be the 20, 30, 40?"
3706.08,15.0," So if I can do that, 40, 30, 20, and I concatenate it with a 10, my job is done. I've successfully reversed 10, 20, 30, 40 to be 40, 30, 20, 10."
3721.08,12.0," So let's just do that. That's me putting my trust in this function I'm writing. I'm calling the same function again saying, hey, I would like to reverse the remainder of the list."
3733.08,9.0," Exactly as we have been in the past, right? Super weird to think about still because we're trusting something that we're writing."
3742.08,8.0," Cool. So then let's test it out. Let's run it. So if I run it with list 12 ABC,"
3750.08,7.0," Python will reverse my list, right? So it will print ABC, then the two, then the one."
3757.08,10.0, Let's say I run it now with something slightly different. So I run it with this list here. How many elements does this list have? Test.
3767.08,9.0," You guys tell me. Three, exactly. The first one is an integer, the second one is a list, and the last one is a list that's got a bunch of garbage in it."
3776.08,5.0," But as test, I don't care because I just care that I have three elements inside."
3781.08,7.0," And so when I run this function on test, it will reverse just the top level because that's what this is doing, right?"
3788.08,8.0," No, we're in here. Did I say I want to reverse lists within lists, right? I didn't say if you're a list, also reverse yourself."
3796.08,8.0," I just said top level, take this element, put it at the end. So when I reverse test, this funky looking test over here,"
3804.08,10.0," it will take that first element, put it at the end. The middle element stays where it is. And the last element comes first."
3814.08,10.0," Is everyone okay so far? I'm worried there aren't many more questions. So, okay."
3824.08,14.0," Right, so that's good. But this is now not really what I'd like, right? What I'd like is if I have lists within lists within lists within lists,"
3838.08,9.0," and those lists have some sort of elements within them, right? At the lowest level, I've got a list that's going to have some integer string or whatever in it."
3847.08,11.0," So what I would like to do is to reverse those elements as well. So really what I would have liked to have if I passed in this list here,"
3858.08,12.0," is to say, well, why don't you reverse everything? So I would like to have had gf as a list, and then the e, and then the d, and then the one."
