start,duration,text
1260.84,3.0, So I'm not going to go through them in too much detail.
1263.84,5.2000000000000455," We can use the square bracket to index into the tuple, so to grab the element at a particular"
1269.04,3.519999999999982," index, again indexing starts from zero."
1272.56,5.0, We can use the plus operator to concatenate two tuples together to create one larger
1277.56,4.079999999999927, tuple with all those elements in a row.
1281.6399999999999,2.800000000000182, We can slice down here.
1284.44,4.399999999999864," We can get the length of the tuple, which tells us how many elements are in it, so three"
1288.84,1.6000000000001364, elements.
1290.44,6.759999999999991," We can use the max, min, sum, things like that to grab the maximum element and minimum"
1297.2,3.6799999999998363," element, sum all the elements of my tuple and things like that."
1300.88,5.3599999999999," Notice that here I've got parentheses for the max function call, and then another set"
1306.24,8.759999999999991, of parentheses here to denote that I have one tuple object I'd like to grab the max of.
1315.0,4.040000000000191, And then the last bit here is something that we're going to see that's different with
1319.0400000000002,3.240000000000009," lists in the set, in next lecture, not today."
1322.2800000000002,5.399999999999864," But basically, you might think that once you create this tuple object in memory, right,"
1327.68,5.6400000000001," it has two MIT-3 as its three elements in it, you can go into memory and modify one of"
1333.3200000000002,1.0," the elements, right?"
1334.3200000000002,3.240000000000009," Like if I don't want the middle one to be a string, I want it to be a common integer,"
1337.5600000000002,3.3999999999998636, you might think that you should be able to change it.
1340.96,5.400000000000091," You can with lists, as we'll see in the next lecture, but you cannot do this with tuples."
1346.3600000000001,6.240000000000009," Just like once we created sort of an integer five inside memory, we can't go into memory"
1352.6000000000001,3.0799999999999272, and tell Python to change this five to a six.
1355.68,1.3199999999999363, It's just not allowed.
1357.0,5.400000000000091," Or once we created a string, ABC, and memory, you can't go into memory and change the string."
1362.4,4.519999999999982," You can certainly create new objects that are based on this string, but you can't go"
1366.92,3.0399999999999636, in and modify that object once it's created.
1369.96,6.639999999999873," So once you've made your sequence of tuples, you cannot go in and change it."
1376.6,1.0, So yeah.
1377.6,1.0, That's a question.
1378.6,5.0," So if you just re-wrote like t equals, and then I go through different, it would be"
1383.6,1.8800000000001091," like, there."
1385.48,2.4400000000000546, If you wrote t equals and then something different.
1387.92,2.3599999999999, So you can't mark it once.
1390.28,2.7999999999999545," Yeah, that's a good question."
1393.08,6.2800000000002," So the variable t, so the name t, and the object it's bound to are two different things."
1399.3600000000001,3.0399999999999636, So the object it's bound to will still sit in memory.
1402.4,1.8799999999998818, We're just going to lose the binding from it.
1404.28,2.759999999999991, So that t initially points to this one.
1407.04,4.120000000000118," But then if you say t equals something else later on, this one still stays there, but"
1411.16,3.3599999999999, that t is going to point to this new thing.
1414.52,2.3199999999999363, So the object itself is still in memory.
1416.84,1.8400000000001455, We've just lost the binding to it.
1418.68,3.839999999999918, And that's something we did sort of way back in the first early lectures where we kind
1422.52,2.2000000000000455, of rebound variables.
1424.72,1.0, Yeah.
1425.72,5.279999999999973, So it's the same idea.
1431.0,5.039999999999964," One interesting thing that we can do now with tuples, that we couldn't with strings, is"
1436.04,5.039999999999964, to have elements of a tuple be another tuple.
1441.08,2.2799999999999727, And that's what this example is going to show.
1443.36,3.759999999999991, So here I've got an integer 2 as my first element.
1447.12,4.279999999999973, My second element is the string A. My third element is my integer 4.
1451.3999999999999,5.720000000000027, And my fourth element is a tuple object that just happens to have two elements inside
1457.12,2.400000000000091, it.
1459.52,8.720000000000027," But this tuple object that I'm referencing by a CQ, C, only has four elements in it."
1468.24,3.3199999999999363, It just so happens that the last one is a tuple.
1472.08,4.6400000000001, I'm not going to dive further down to figure out if I have tuples that have sub tuples that
1476.72,1.9199999999998454, have sub tuples and so on.
1478.6399999999999,4.880000000000109, Only top level I care about how many elements I have.
1483.52,3.240000000000009," And so when I print the length of seek, it's going to be four, right?"
1486.76,1.8799999999998818," Because I have one, two, three."
1488.6399999999999,4.480000000000018, And then this last object is just one object that takes up one slot.
1493.12,4.519999999999982, It happens to have elements within it.
1497.64,6.039999999999964, So the rest of these are basically what we've seen with strings except for this one here.
1503.68,7.319999999999936," If we were to index into the last element here of seek 1,2, well, this is another tuple,"
1511.0,0.5200000000002092, right?
1511.5200000000002,6.759999999999991, So it should follow that I can then take that tuple and further index into it.
1518.2800000000002,4.1599999999998545, And so that's what this line here is doing.
1522.44,2.2799999999999727," When we read an expression, we go left to right."
1524.72,5.0," So basically seek at index three grabs for me the 1,2."
1529.72,6.519999999999982," And then if I further index into 1,2 at index zero, I'm going to grab the number one."
1536.24,1.0, All right.
1537.24,8.039999999999964, So I'm basically chaining all these indices indexing operations together.
1545.28,4.440000000000055, And then this is again very similar to what we've seen from strings.
1549.72,3.6400000000001, So it's just slicing instead of indexing into the tuple.
1553.36,5.839999999999918," I'm not going to go through it today, but I encourage you to type them in and type in some"
1559.1999999999998,5.680000000000064, other things as you might have done with the strings.
1564.8799999999999,7.0, One thing that I do want to mention is that we can iterate over a tuple just like we could
1571.8799999999999,2.0399999999999636, iterate over a string.
1573.9199999999998,4.279999999999973," I don't mean over indices, but I mean over the elements directly."
1578.2,6.6400000000001," So when we iterate it over a string directly, we were able to grab in our loop variable the"
1584.8400000000001,2.2799999999999727, characters at each index.
1587.1200000000001,1.0, Right?
1588.1200000000001,5.399999999999864," Similarly, we can iterate over a tuple to grab the elements at each index directly."
1593.52,8.039999999999964," So here, I've got four E in seek is going to make my loop variable E take on each element"
1601.56,2.520000000000209, of the tuple directly.
1604.0800000000002,1.759999999999991," Not the index, but each element."
1605.84,5.519999999999982," So as I'm looping through, E will first have a value 2, then it will have a value A, then"
1611.36,4.6400000000001," it will have a value 4, and lastly, it will have this value 1, 2."
1616.0,8.839999999999918," So if I just print that out directly, you'll see these values printed out."
1624.84,4.6400000000001," So very, very similar to some of the operations we've done with strings, the only differences"
1629.48,5.7199999999998, we just now have to be careful that our tuples can have elements that are other tuples
1635.28,4.120000000000118, or basically any object in Python.
1639.4,2.1599999999998545, So what do we use tuples for?
1641.56,6.360000000000127," Well, there was this one example we did way back at the beginning of this of 600L, where"
1647.92,4.3599999999999," we tried to swap variables, and we basically said that this way did it work because we"
1652.28,1.3600000000001273, overwrote the variable.
1653.64,1.0, Right?
1654.64,3.9600000000000364," We overwrote the variable, and then we weren't able to get back to the value that was over"
1658.6000000000001,1.1599999999998545, it.
1659.76,5.559999999999945, So our solution was to create this temporary variable to save the value before we overwrote
1665.32,5.680000000000064," it, then overwrite the variable, and then use the temporary variable to grab back that"
1671.0,1.8799999999998818, saved value.
1672.8799999999999,5.040000000000191," Well, it turns out tuples actually allow us to do these three lines of code in one line"
1677.92,2.3599999999999, of code here.
1680.28,5.599999999999909," So we can say x, y equals y, x."
1685.88,5.519999999999982," So this is an assignment, and it's allowed because the left-hand side is basically a set"
1691.4,4.6400000000001, of variables in sequence.
1696.0400000000002,5.1599999999998545, And the right-hand side gets evaluated first as we would an assignment statement.
1701.2,4.960000000000036," So y gets the value 2, because that's what it is up here, and x gets the value 1."
1706.16,3.6400000000001, So y is 2x is 1 over here on the right-hand side.
1709.8000000000002,5.0," And then Python 1 at a time matches the values on the right to the values on the left,"
1714.8,2.0399999999999636," right, separated by commas."
1716.84,5.440000000000055," So basically what we have here is x is equal to 2, y is equal to 1, and then the values"
1722.28,4.839999999999918, have been rebounded.
1727.12,6.7999999999999545," So very, very, very useful, very good use of tuples here."
1733.9199999999998,7.160000000000082," Now this idea can actually be taken one step further, and we can use tuples to return"
1741.08,4.2000000000000455, more than one value from a function.
1745.28,7.1599999999998545, Now I know in the past couple lectures I said basically you can't return more than one
1752.4399999999998,2.160000000000082," thing from a function, right?"
1754.6,1.7999999999999545, The function returns only one thing.
1756.3999999999999,4.7999999999999545," As soon as it sees a return statement, it takes the value associated with that return"
1761.1999999999998,3.9200000000000728, and returns it back to whoever called it.
1765.12,3.0, But tuples are one object.
1768.12,4.7999999999999545," They just so happen to have elements that can have different values, right?"
1772.9199999999998,1.7999999999999545, You can have a tuple with 10 elements in it.
1774.7199999999998,3.400000000000091, You can have a tuple with two elements in it.
1778.12,5.599999999999909," Using a tuple we can actually return one object, the tuple itself."
1783.7199999999998,4.440000000000055," It just so happens to have a whole bunch of values that my function might calculate,"
1788.1599999999999,1.3199999999999363, right?
1789.48,5.880000000000109," And so by way of the tuple, I'm actually able to return a whole bunch of different values"
1795.3600000000001,2.0, through this one object tuple.
1797.3600000000001,4.319999999999936," And so in this particular example, I have a function that calculates the quotient and"
1801.68,5.079999999999927, the remainder when x is divided by y.
1806.76,7.839999999999918, So the function itself uses integer division to find the quotient and uses the remainder
1814.6,2.3200000000001637, operator to find the remainder.
1816.92,3.7200000000000273," And then it returns that q calculation, right?"
1820.64,4.920000000000073," Some number and that our calculation, another number, as elements to a tuple."
1825.5600000000002,8.639999999999873," And Python returns this one tuple object using this line here, returning this object."
1834.2,6.6400000000001," And so when I make this function call to quotient and remainder 10,3, it's going to go in,"
1840.8400000000001,3.759999999999991," it's going to calculate the quotient to be three, the remainder to be one."
1844.6,4.119999999999891," And it's going to return one object, three comma one."
1848.7199999999998,4.600000000000136," And then that gets assigned to this variable, both, that I named both in this particular"
1853.32,3.839999999999918, case.
1857.1599999999999,4.8400000000001455," If I wanted to access the quotient part of both, I would do both square bracket zero and"
1862.0,3.199999999999818," the remainder part of both would be both square bracket one, right?"
1865.1999999999998,3.040000000000191, Accessing the zero element and the first element of the return.
1869.2,5.879999999999882, Now if I wanted to explicitly save the quotient and remainder as variables after they got
1875.08,5.040000000000191," returned, I can actually do the trick we saw in the previous slide, right?"
1880.1200000000001,4.679999999999836, The trick we saw in the previous slide was x comma y equals some other tuple.
1884.8,1.759999999999991, Well that's what I'm doing here.
1886.56,3.400000000000091, I'm making a function called a quotient and remainder 5 comma 2.
1889.96,3.160000000000082, That's going to return 2 comma one.
1893.1200000000001,4.919999999999845, And then I'm going to have quote comma rem equals 2 comma one.
1898.04,6.720000000000027, So Python one at a time is going to map the quote to 2 and the rem to 1.
1904.76,6.279999999999973, And so what that means for us in terms of the code is we can then do whatever we'd like
1911.04,2.0399999999999636, in the remaining part of the code.
1913.08,4.079999999999927, Code assuming that quote and rem are just regular variables.
1917.1599999999999,4.480000000000018," So here I'm just showing that you can print them out in these print statements, right?"
1921.6399999999999,5.400000000000091, So here I have quotient is 2 and remainder is 1 as these two lines of code here.
1928.04,6.319999999999936, OK.
1934.36,7.240000000000009," So the big idea of tuples, the reason why we use them is you can use them to return more"
1941.6,5.960000000000036, than one value via this one tuple object from a function.
1947.56,4.599999999999909," And so in this way we can have a function that does a whole bunch of calculations, returns"
1952.16,5.519999999999982, this one object that might contain all of these different values as the elements to this
1957.68,2.6800000000000637, tuple object.
1960.3600000000001,3.8799999999998818, So let's have you work on this for a couple minutes.
1964.24,2.0, Write a function that meets the specification.
1966.24,2.160000000000082, So it's called char counts.
1968.4,4.039999999999964," I've got an input that is a string s, lower case characters."
1972.44,3.1200000000001182, Assume it's just got vowels and consonants.
1975.5600000000002,3.759999999999991, Return for me a tuple where the first element in the tuple is how many vowels are in
1979.32,4.400000000000091, this and the second element of the tuple is how many consonants are in this.
1983.72,2.519999999999982, So it should be pretty straightforward.
1986.24,4.639999999999873," A hint I have here, if you don't remember that will make your life easier, is try to"
1990.8799999999999,3.880000000000109, remember how to check if a character is in a string.
1994.76,4.599999999999909," So using the special in keyword, right?"
1999.36,7.720000000000027, We saw an example of this probably back when we learned about strings.
2007.08,7.0, So you can try to write your code around line 65-ish and then we can write it together.
2014.08,6.400000000000091," All right, so how would you approach this problem?"
2020.48,4.439999999999827, So what's the first step here?
2024.9199999999998,8.360000000000127," Yep, we can make a string that contains all the vowels."
2033.28,5.0," vowels equals a, o, u and lower case."
2038.28,2.0, Nice.
2040.28,3.0, Next.
2043.28,1.0, Yeah.
2044.28,15.999999999999773," So if the car is in that list, then we could like have a mirror work in track like plus equals."
2060.28,5.0," Yep, vowels plus equals one."
2065.28,7.2800000000002," And else, we know it's not a vowel, so we'll keep a consonants count plus equals one."
2072.5600000000004,9.4399999999996, So this is the consonant count and this is the vowels count.
2082.0,7.400000000000091, What is char in this case though?
2089.4,1.0," Yeah, exactly."
2090.4,4.0, We have to loop so four char in S.
2094.4,4.0, So we need to look at every character inside S.
2098.4,8.0, And this is where now that we're dealing with things that are just that might be non-intergers in my four loops.
2106.4,2.0, We can write little notes for ourselves.
2108.4,7.0," That's something like char is a, then b, then c, or something like that."
2115.4,7.0," So if we find us that char is not sort of the index, but it's an actual thing."
2122.4,8.0, And then what else we need to do?
2130.4,3.0," Yeah, we can initiate c and v zero."
2133.4,6.0, We can use the trick where you do c comma v equals zero comma zero.
2139.4,2.0, Or we can just do it on separate lines.
2142.4,8.0," And then lastly, this does the work for us, but the function needs to have something to show for it."
2150.4,8.0," Yeah, after the loop, we'll return the tuple c comma v."
2158.4,5.0," Sorry, v comma c, probably."
2163.4,5.0," And if we run it, it matches what we expected."
2168.4,2.0," So one, three, and zero, five."
2170.4,5.0," And you can imagine adding a couple more test cases, maybe something with an empty string."
2175.4,12.0," That should return zero zero and maybe something with all vowels, which should return some number comma zero."
2187.4,9.0," Okay, so one other thing we can do with tuples is to create these functions that take a variable number of arguments is in as a parameter."
2196.4,7.0," So remember when we define functions, we basically tell Python how many parameter we expected to take."
2203.4,7.0," But it's possible to have some functions, for example, max or min, that can take in two parameters here."
2210.4,2.0, Notice there's no extra parentheses.
2212.4,8.0," Or we can just add as many numbers as we'd like, and it will still work to take the max of all of these sets of numbers."
2220.4,8.0," And again, we didn't make this inner thing a tuple, although it works even with the tuple as an object."
2228.4,7.0," But our goal here is to try to write a function that can take in a variable number of arguments, right?"
2235.4,2.0, Either two or three or ten or twenty.
2237.4,2.0, And it should still work.
2239.4,6.0, And the way we do that is using a parameter that's defined using the star notation.
2245.4,7.0," So as soon as you create a function, and its parameter is star, and then the name of your input,"
2252.4,5.0, Python basically takes that input and assigns it to a tuple behind the scenes.
2257.4,2.0, So you don't have to.
2259.4,5.0," Okay, and so in this particular case, we're not using, not writing our own max or min or some."
2264.4,4.0, We're writing our own mean function.
2268.4,5.0," And this mean function will take in a variable number of arguments, right?"
2273.4,3.0, And it's going to figure out the mean of all of these values.
2276.4,3.0, The way it does that is pretty simple.
2279.4,6.0, Now that we know that we can just treat args as a tuple of a bunch of numbers.
2285.4,4.0, So we just loop through all of the elements in args.
2289.4,7.0," We add up this running total, and at the end we return the total divided by how many arguments were given."
2296.4,3.0, So we're turning total divided by the length of the args.
2299.4,7.0," And then when we make a function call to the function we just wrote mean here, args will take in,"
2306.4,7.0," sorry, args will become a tuple that's all of the parameters inside there."
2313.4,9.0," And so here's that example, which means that we can use our function to get the mean of 1, 2, 3, 4, 5, 6."
2322.4,4.0, But we can use the exact same function to get the mean of 609 for example.
2326.4,7.0," So first case I have 6 parameters as my input, but in the second case I've got only 3 parameters as my input."
2333.4,7.0, And that little star in my arguments allows me to do this.
2340.4,10.0, Now I did write a version of this mean for you guys down here where I'm assuming that mean doesn't have the star.
2350.4,3.0, So assuming that args is a tuple itself.
2353.4,8.0, And in that case you would have to call the mean function by explicitly passing in only one argument that is a tuple.
2361.4,5.0, So this extra set of parentheses makes my argument the tuple.
2366.4,6.0, So you'll take a closer look at that if you're interested.
2372.4,4.0, So I want to introduce lists today.
2376.4,6.0, And a lot of the slides here are basically copy and paste from the tuple slides.
2382.4,7.0, The only difference in these slides that I have regarding lists is the way we define a list.
2389.4,6.0, So in terms of defining a list or defining a tuple we were using parentheses.
2395.4,4.0, But to define a list we use open closed square brackets.
2399.4,7.0, But otherwise a lot of the operations are exactly the same as tuples and as strings.
2406.4,8.0, We're not going to look at what it means for lists to be mutable this lecture but next lecture will be all about mutability.
2414.4,5.0, But today I just want to give you a sense of what a list is.
2419.4,4.0, So as I said this is copying and paste from the tuple slide.
2423.4,4.0, When I create a list I just use open and closed square brackets.
2427.4,4.0, This creates a list for me with no elements within it.
2431.4,9.0, Creating a list with one element in it doesn't need that extra comma because there's no confusion with operation precedence with square brackets.
2440.4,2.0, So there's no need for that.
2442.4,4.0, But otherwise everything else here is exactly the same as with tuples.
2446.4,5.0, We're just using square brackets instead of parentheses.
2451.4,3.0, So remember strings and tuples it's the same.
2454.4,11.0, What I do want to mention and talk a little bit about now that we've introduced tuples and lists is the idea of having our loops iterate over elements of tuples and lists directly.
2465.4,8.0, And I'm going to basically write these slides in the context of lists but the exact same thing is applicable to tuples as well.
2473.4,6.0, So here is an example of us wanting to find the sum of the elements in a list.
2479.4,4.0, The code on the left is a little bit hard to parse.
2483.4,11.0, We've got a loop variable going through range length and then I have to keep my running total but I have to index into the list at that index here.
2494.4,4.0, And it's really hard to tell what's going on at a quick glance.
2498.4,9.0, And so luckily for us right the way that we were able to iterate over string characters directly we can iterate over tuple and list elements directly.
2507.4,8.0, So the right hand side here is exactly this code that does exactly the same thing as the one on the left.
2515.4,10.0, Except that our loop variable i in this particular case will take on the values of my list directly.
2525.4,8.0," And so if we take that code, yes, I guess we call this version more pithonic because it's a lot easier to read."
2533.4,12.0, So if we take that code and wrap it around a function to make this piece of code be something that we can reuse in a whole bunch of places to grab the sum of all the elements of a list.
2545.4,5.0, We can do that. So here I've taken the code that does the work.
2550.4,3.0, I've plopped it inside this function. I've named list sum.
2553.4,6.0," I've taken a list as a parameter. And instead of printing the total, I'm returning the total."
2559.4,4.0, So very useful function now.
2563.4,9.0, This loop variable i will take on the values eight then three then five if that's the list I called this function with.
2572.4,9.0, So a lot nicer than iterating over the index and then indexing into the list with the square brackets at that index.
2581.4,12.0, What I do want to mention is something sort of when you're writing code and this is something that I sort of used to do when I first started out is to write a little comment for yourself right underneath the for loop.
2593.4,12.0, Now I know it's it's a little tedious but it does help you keep track of especially if you're if now that we're iterating over tuples or over lists over string elements directly or even over the indices.
2605.4,7.0, It helps you keep track of what this loop variable is values going to be right and then you don't have to keep track of it in your mind.
2612.4,3.0, It's on paper and you can use your mind to keep track of other things.
2615.4,7.0, So if you just write a little comment for yourself there it helps you debug along the way.
2622.4,8.0, So once we have these once we iterate over list elements directly it makes code that we write really easy to read.
2630.4,6.0, So here the code on the left is going to iterate over the elements directly and get the running total.
2636.4,4.0, But we can make a really small change to the input list.
2640.4,8.0, Let's say our input list no longer takes in just numbers but it can take in strings.
2648.4,6.0, We can make one small change to our loop to our loop body.
2654.4,11.0, Our loop variable still iterates over all the elements in the list L and then if we write the note for ourselves that s is going to be a b then df then g.
2665.4,14.0, If we wanted to write code that grabbed the sum of all of the lengths of the list the total plus equals e on the left hand side becomes total plus equal length of s on the right hand side.
2679.4,12.0, So length of s one at a time will take on the value two because a b has length two and then three because df has length three and then one because g has length one.
