start,duration,text
1234.3600000000001,5.1599999999998545, The reason why we're doing slash slash for integer division is in the case where I have
1239.52,4.039999999999964, a list where I would actually look at the midpoint here.
1243.56,8.240000000000009," Right, obviously I can't ask Python for the element at index 3.5."
1251.8,1.0, Right?
1252.8,1.0, It doesn't work like that.
1253.8,2.0399999999999636, So I'm just going to round down.
1255.84,1.5199999999999818, You could also round up if you wanted to.
1257.36,1.6000000000001364, I just made the choice to round down.
1258.96,4.7999999999999545, So I'm actually grabbing the element at an integer index.
1263.76,5.2000000000000455," Right, so I've grabbed my middle element and then I ask, are you the one I'm looking for?"
1268.96,5.759999999999991," And if not, I ask whether this one is too low or too high."
1274.72,7.759999999999991," And then if it's too low, then I know I need to search this part of my list."
1282.48,3.6800000000000637," And if it's too high, I need to search this part of my list."
1286.16,1.0, Right?
1287.16,3.9199999999998454, So that's what this little if else is doing.
1291.08,6.960000000000036," And when I make my decision as to which side to look at, then I reset my endpoints."
1298.04,5.240000000000009," And I do the process all over again by asking the midpoint there, are you the one I'm looking"
1303.28,1.0," for, so on and so on."
1304.28,1.0, Right?
1305.28,7.039999999999964," So this does a bisection search, also called binary search for the element in a list."
1312.32,5.0, And the last way for us to search whether an element is in a list is one that we've already
1317.32,1.0, been doing.
1318.32,6.039999999999964, It's this little one liner here is x in L. So using the keyword in.
1324.36,1.0, Right?
1325.36,5.680000000000064," So that's, I call that the built in function, the built in operator in."
1331.04,2.7200000000000273, Okay.
1333.76,10.279999999999973," So it would be unfair if we just ask Python to figure out, to just pick a random number"
1344.04,3.8799999999998818, and ask whether that element was the one we're looking for.
1347.9199999999998,3.9200000000000728, So instead what we're going to do is to kind of take an average for each one of these
1351.84,2.9600000000000364, three functions just to make it fair.
1354.8,4.7999999999999545," So we're going to say, when we're searching for an element in the list, I'm going to say"
1359.6,4.680000000000064, that I'm going to take the average of the case when the element is the first one in the
1364.28,1.9200000000000728, list.
1366.2,4.959999999999809, And I can find it maybe right away in this case or maybe not right away in this case.
1371.1599999999999,6.960000000000036, The average with that plus when the element is the last one in the list and plus when
1378.12,3.1200000000001182, the element is the middle one in my list.
1381.24,1.0, Right?
1382.24,5.759999999999991," And that way we're actually kind of covering all our bases, kind of best case, worst case,"
1388.0,3.0399999999999636, medium case scenarios.
1391.04,6.680000000000064, So each one of these three functions will be run with that in mind.
1397.72,1.7999999999999545, So that's these three functions.
1399.52,2.9600000000000364, So this is my brute force is in.
1402.48,3.759999999999991, This is my binary search.
1406.24,5.240000000000009," And the end, obviously I'm just going to type in in when I run it."
1411.48,1.7200000000000273, So I'll just show you for one of them.
1413.2,7.839999999999918, So we're going to uncomment this entire bit here.
1421.04,5.279999999999973," But you can see here, so instead of just running the performance counter and making one function"
1426.32,4.080000000000155," call, I'm actually going to run three function calls."
1430.4,5.439999999999827," It rated over this little loop where I'm looking for the element at the zeroth location,"
1435.84,6.680000000000064, the element at the halfway location and the element at the end of my list.
1442.52,2.9199999999998454, And I'm just averaging those down here.
1445.4399999999998,1.800000000000182, The time it takes to find those three.
1447.24,3.439999999999827, Does that make sense?
1450.6799999999998,1.0, Okay.
1451.6799999999998,1.0, All right.
1452.6799999999998,2.3200000000001637, So this is a lot to look at.
1455.0,4.039999999999964," Luckily, I'm going to summarize it in the next few slides."
1459.04,5.599999999999909, So we don't have to stare at that Python screen there.
1464.6399999999999,1.0, Okay.
1465.64,2.0399999999999636, We have three functions to run.
1467.68,3.519999999999982, Let's first look at how each of these three functions did individually.
1471.2,3.0, And then we can start comparing them to each other.
1474.2,3.2000000000000455, So the first function we ran was the is in.
1477.4,1.759999999999991," So remember, this was the brute force one."
1479.16,3.400000000000091, We're painstakingly going through each element and asking if it's the one we're looking
1482.5600000000002,1.0, for.
1483.5600000000002,1.1599999999998545, So no smart way about that.
1484.72,3.0, Just brute force your way through.
1487.72,10.88000000000011," We notice that as the input list grows by 10, the time it takes to find the element in"
1498.6000000000001,5.7999999999999545," the list, whether it's the first one, last one, or in the middle, on average also grows"
1504.4,2.7999999999999545, by 10.
1507.2,3.240000000000009, Okay.
1510.44,3.240000000000009, All right.
1513.68,1.0, Next.
1515.0800000000002,2.519999999999982, Let's look at the built-in function.
1517.6000000000001,2.6799999999998363, We'll worry about the binary one later.
1520.28,9.519999999999982," The built-in function, so just using the inoperator and you see this was down here."
1529.8,1.0, So this in.
1530.8,4.360000000000127," So basically, the function I'm running is purely just asking whether x is in L."
1535.16,1.0, Right.
1536.16,2.4400000000000546, And that returns true or false.
1538.6000000000001,2.0, So I didn't need to make a function for that.
1540.6,5.920000000000073, But that built-in inoperator also has a very similar trend.
1546.52,1.0, Right.
1547.52,7.679999999999836," As the length of my list increases by 10, the time it takes for my program to run is also"
1555.1999999999998,1.400000000000091, 10 times as long.
1556.6,1.0, Right.
1557.6,6.160000000000082," I went 0.05, 2.5, and the next one would be 5 and so on."
1563.76,1.0, Right.
1564.76,1.959999999999809, Okay.
1566.72,6.6400000000001," So those seem to be doing approximately the same sort of, they have the same performance."
1573.3600000000001,5.7999999999999545, Now what about the bisections or binary search?
1579.16,3.5599999999999454," Well this one is not so clear, right?"
1582.72,8.559999999999945," If we look at the input, right, the input clearly increases by 10 from here to here."
1591.28,6.920000000000073, The time increases 9 times and the negative 6 to 1.1 times and negative 5.
1598.2,7.839999999999918," And so the factor, how many more times it took is very unclear."
1606.04,1.3199999999999363, It's not quite one.
1607.36,3.560000000000173," If it was one that meant it's independent, right, it's constant."
1610.92,3.839999999999918," It doesn't matter what the input size is, it's always going to give us this amount."
1614.76,1.400000000000091, It's always going to run in this amount of time.
1616.16,1.7999999999999545, So it's not quite one.
1617.96,5.480000000000018," So it's almost independent of size, but it's not linear, right, like the other two functions"
1623.44,1.0, were.
1624.44,3.4400000000000546," Right, it's not 10 when the input grows by 10."
1627.88,3.199999999999818," So we're not quite sure what this function is, right?"
1631.08,6.360000000000127," But clearly it's not as bad as the other two, but not as good as no relation."
1637.44,1.9600000000000364, Okay.
1639.4,1.599999999999909, Observation 3.
1641.0,5.519999999999982," Observation 4 will now compare the function that we wrote, the is in, this one here, to"
1646.52,3.5599999999999454," the binary search, this one down here."
1650.08,9.759999999999991," Well, binary search was orders of magnitude faster than brute force, right?"
1659.84,3.7200000000000273," Brute force, when the input was, what is this, 10 million or 100 million?"
1663.56,1.7200000000000273, I'm not sure.
1665.28,6.759999999999991," When the input was 100 million, brute force took 1.6 seconds."
1672.04,7.160000000000082," But the bisection search, the binary search, took 0.0001 seconds."
1679.2,5.439999999999827, So it's not like we went from 1.5 seconds to 1.2 seconds or 2.5 seconds.
1684.6399999999999,2.6800000000000637," We were orders of magnitude faster, right?"
1687.32,2.4400000000000546," 10 to the negative 5, right?"
1689.76,5.599999999999909," So there's a really big difference between this algorithm, the one that brute forces its"
1695.36,5.160000000000082," way through, and between this algorithm that does something smart about removing half"
1700.52,3.599999999999909," of the search space with each loop, right?"
1704.12,1.0, All right.
1705.12,1.759999999999991, So that's important to know.
1706.8799999999999,6.0," And lastly, just kind of comparing pure time that it takes these programs to run."
1712.8799999999999,4.360000000000127," Let's compare the function that we wrote, the one that loops one at a time through this"
1717.24,5.599999999999909," list, and the built-in in function."
1722.84,5.920000000000073," The built-in in function, see, while it's still the same sort of, has the same relationship,"
1728.76,2.3599999999999," linear, right, with the input size."
1731.12,7.600000000000136," It seems to do a lot better consistently by about 10 times as fast, right?"
1738.72,7.599999999999909," So when our function took 0.1 seconds, the built-in 1 took 0.05 seconds, where when our function"
1746.32,3.519999999999982," took 1 second, the built-in function took 0.5 seconds."
1749.84,5.8400000000001455," So consistently, it's just faster to use the built-in in function than to make our own."
1755.68,3.480000000000018, All right.
1759.16,2.599999999999909, Questions about any of these observations?
1761.76,3.519999999999982, And they make sense.
1765.28,3.2000000000000455, Are they interesting?
1768.48,1.0, Yeah.
1769.48,1.0, Okay.
1770.48,2.0, So what do we see?
1772.48,3.8400000000001455," Just a quick recap of those three functions, right?"
1776.3200000000002,2.8799999999998818," The first one, we saw is linear in the size of the arguments."
1779.2,4.960000000000036," So when the input list size increases by 10, the program takes 10 times as long to run."
1784.16,3.4400000000000546," What this other one is something less than linear, but it's not constant."
1787.6000000000001,2.240000000000009, So we're not quite sure what it is.
1789.8400000000001,1.0, All right.
1790.8400000000001,1.759999999999991, We'll come back to this in a little bit.
1792.6000000000001,3.9600000000000364," We'll end up plotting some of these run times, so we'll actually be able to see the"
1796.5600000000002,4.919999999999845, relationship in a few slides.
1801.48,6.080000000000155, The next thing I actually want to do is do one more sort of function.
1807.5600000000002,2.839999999999918," This one is called the diameter, right?"
1810.4,3.4400000000000546, And I'll explain what it's doing because it looks a little bit scary.
1813.8400000000001,6.720000000000027," But suppose we actually have some points in a 2D plane, right?"
1820.5600000000002,2.3999999999998636, So it looks like this.
1822.96,5.400000000000091, Basically what this function is going to do is it's going to figure out the biggest
1828.3600000000001,3.0399999999999636, distance between all of these points.
1831.4,4.0, So the distance between these two points is something.
1835.4,3.0, This is the distance between these two points is something else.
1838.4,3.2000000000000455, Which two points yield the biggest distance?
1841.6000000000001,5.7999999999999545, That's what this function aims to tell us and what that distance is.
1847.4,3.599999999999909, So the way it works is it has nested four loops.
1851.0,2.3200000000001637, So this is different than what we've seen so far.
1853.3200000000002,4.3599999999999," We saw an example of this last lecture, but now we're seeing it in the context of something"
1857.68,1.5199999999999818, actually useful.
1859.2,5.559999999999945," So in this particular case, we're going to create an input list."
1864.76,5.720000000000027," So again, our input list will just have some dummy values in it."
1870.48,1.9600000000000364, I don't actually care what these numbers are.
1872.44,4.439999999999827, I just want to populate a whole bunch of points in a 2D plane.
1876.8799999999999,5.680000000000064," So what we're going to do is pretty much just iterate from number 0 to 10,"
1882.56,3.400000000000091," sorry, 0 to 9, 0 to 99, 0 to 999."
1885.96,2.119999999999891, So on just like we did before.
1888.08,5.480000000000018," And to get us a little coordinate in the 2D plane based on those numbers,"
1893.56,5.119999999999891," I'm just going to take the cosine of that number, comma the sine of that number."
1898.6799999999998,9.720000000000027," So that together, so like cosine of 1 or whatever, sine of 1 will be this point here."
1908.3999999999999,1.240000000000009, Set up as a 2.
1909.6399999999999,7.560000000000173," And then this one might be cosine of 5, comma sine of 5, something like that."
1917.2,2.8799999999998818," So I'm just making a whole bunch of coordinates in a 2D plane,"
1920.08,4.400000000000091, ensuring that I have n coordinates.
1924.48,5.959999999999809," OK, now the loop, sorry, there's going to be two loops."
1930.4399999999998,6.960000000000036, The outer loop will basically take us through each of these elements.
1937.3999999999999,3.0399999999999636, I have 5 in this particular case.
1940.4399999999998,4.160000000000082, And the inner loop will go through every other element.
1944.6,2.2799999999999727, But notice it starts from i plus 1.
1946.88,3.519999999999982, And I'll tell you why that is instead of starting from 0.
1950.4,2.3600000000001273, So let's just walk through.
1952.7600000000002,2.8799999999998818, Let's say we start out with this element.
1955.64,4.839999999999918, This log is our first element in our outer for loop.
1960.48,4.960000000000036," So right now, we've grabbed the first element in our outer for loop."
1965.44,5.2000000000000455, And what we're going to do is figure out the distance between it and everybody else.
1970.64,3.2000000000000455," So now we're iterating through the inner for loop,"
1973.84,3.880000000000109, going through each element except for myself.
1977.72,2.759999999999991, So I'm going to get the distance between this one and this one.
1980.48,3.5599999999999454," Since it's the first one, obviously, it's the biggest one."
1984.04,3.519999999999982, But then I'm going to get the distance between this one and this one.
1987.56,2.519999999999982," And I'm going to say, are you bigger than this one?"
1990.08,0.9200000000000728, It looks like no.
1991.0,2.599999999999909, So we're still keeping this one as our longest one.
1993.6,3.6800000000000637, Then I'm going to grab the distance between this and this one and this and this one.
1997.28,6.2000000000000455," And as I'm going through, this little if statement here keeps track of the farther one."
2003.48,2.759999999999991, So the one that has the biggest magnitude.
2006.24,3.839999999999918," In this case, that's probably the first one we looked at."
2010.08,3.880000000000109," And after I've gone through each element, each other element,"
2013.96,6.759999999999991, I've concluded my first iteration in my outer for loop.
2020.72,5.3599999999999," So now, the outer for loop goes to the next element in the list."
2026.08,1.5199999999999818, Let's say it's this one.
2027.6,2.7600000000002183, That doesn't actually matter.
2030.36,5.759999999999991," This one, we'll look at the distance between itself and everybody else except for the one"
2036.12,0.9600000000000364, we already looked at.
2037.08,1.6399999999998727, Because we already know this distance.
2038.7199999999998,3.4400000000000546, We kept track of it already when we iterated through this one.
2042.1599999999999,6.0," So as I'm going through my outer for loop keeping track of this point here,"
2048.16,5.119999999999891," it figures out the distance between this one, this one, which is suddenly bigger than"
2053.2799999999997,1.6400000000003274," that one, which we had kept track of."
2054.92,2.9600000000000364, And then this one right here.
2057.88,0.3999999999996362, All right.
2058.2799999999997,0.24000000000023647, Good.
2058.52,2.480000000000018, So now we're still keeping track of the biggest distance we've seen.
2061.0,1.8400000000001455, It's probably this one here.
2062.84,3.199999999999818, And I've concluded the second iteration of my outer for loop.
2066.04,1.8400000000001455, And now I go to the next element.
2067.88,1.0399999999999636, Let's say it's this one.
2068.92,1.5599999999999454, Doesn't matter again.
2070.48,4.079999999999927," Now, this one is going to get the distance between itself and everybody else except for"
2074.56,1.9200000000000728, the two that we've already seen.
2076.48,1.4800000000000182, This one and this one.
2077.96,3.1599999999998545, So that's why our inner loop starts at i plus 1.
2081.12,3.800000000000182, So this one will get the distance between itself and this one all the way back there.
2084.92,2.7599999999997635, And this one all the way over here.
2087.68,4.360000000000127," And then next iteration in the outer for loop takes a look at this one, let's say."
2092.04,2.5599999999999454, And it finds the distance between itself and everybody else.
2094.6,0.6399999999998727, But you know what?
2095.24,1.0, There's only one left.
2096.24,2.5599999999999454, That one there.
2098.7999999999997,4.8400000000001455," And then the last time through, this one doesn't even get a chance to find the distance"
2103.64,6.880000000000109, between itself and anybody else because everybody else already found the distance between it.
2110.52,4.239999999999782," And so in this way, we're basically finding all the possible pairs of all of these points"
2114.76,5.199999999999818, in this 2D plane and keeping track of the biggest distance.
2119.96,6.680000000000291," So in terms of the input list, the way that looks like, this i plus 1 business here,"
2126.6400000000003,4.1599999999998545," the outer loop basically says, I'm going to start with you and I'm going to get the difference"
2130.8,6.320000000000164," between you and the element at index 1, the element at index 2 and the element at index"
2137.1200000000003,2.799999999999727, 3.
2139.92,1.800000000000182, This outer for loop is done.
2141.72,4.7199999999998," Next, we're going to get the distance between this one and everybody else."
2146.4399999999996,3.7200000000002547, So obviously not the element index here because we already know that distance.
2150.16,5.639999999999873, So we're going to get the distance between element at index 1 and index 2 and index 3.
2155.7999999999997,1.0, And then we're done.
2156.7999999999997,5.680000000000291," And then the last loop, outer loop, gets the distance between element at index 2 and index"
2162.48,1.0, 3.
2163.48,1.5199999999999818, And then it's done.
2165.0,8.199999999999818, So just these two nested loops just does all of this until it finds all of these pairs.
2173.2,5.200000000000273, It basically pairs up everybody together.
2178.4,5.960000000000036," Okay, so if we run it, what are we going to see?"
2184.36,5.7599999999997635," So my input for this particular function, you'll notice, first of all, is going to be"
2190.12,4.960000000000036," much, much smaller than the inputs for everything we've done so far."
2195.08,5.279999999999745," Some of the inputs we had seen in the past were a million, 10 million, 100 million."
2200.3599999999997,4.880000000000109," In this particular case, I'm only going to go up to 6,000 because it's just going to"
2205.24,6.680000000000291, take way too long to run if I make it go for any longer than that.
2211.92,2.0799999999999272, So what do we see already?
2214.0,9.480000000000018," We've got 100 points, so 100 of these, finding the maximum distance between a bunch of these"
2223.48,3.3600000000001273," pairs, took about 0.03 seconds."
2226.84,4.920000000000073," If we doubled that to 200 points, it took 0.01 seconds."
2231.76,5.4399999999996," If we doubled that to 400 points, it took 0.05 seconds and so on and so on."
2237.2,5.5600000000004," So just like before, let's take a look at big numbers to see our trend."
2242.76,7.800000000000182," So as the numbers increase by 2, if my input increases by 2, it looks like the time that"
2250.5600000000004,4.599999999999909, it takes for me to find out the biggest distance increases by 4.
2255.1600000000003,4.639999999999873," So my input increases by 2, the time increases by 4."
2259.8,4.039999999999964," And I'm not going to run this, but you can make a new list on your own and change this"
2263.84,7.960000000000036," to be inputs that are multiples of 10, increasing by 10 each time."
2271.8,4.760000000000218, And you'll see a very similar pattern where the time it takes to run that program will
2276.5600000000004,3.0, be about 100 times as slow.
2279.5600000000004,7.599999999999909, So the relationship there is a n squared kind of relationship.
2287.1600000000003,2.7599999999997635, So a few observations here as well.
2289.92,6.559999999999945, First one I already mentioned is this program just takes a lot longer to run in general.
2296.48,5.599999999999909, So here we were able with compound and with finding whether an element is in the list and
2302.08,2.200000000000273, getting the sum of all the elements in the list.
2304.28,5.4399999999996," We were able to run 100 million, a list with 100 million elements and it still took"
2309.72,3.1600000000003092, about once something seconds.
2312.88,5.799999999999727," Whereas with this diameter function, we can barely get to 6,000 and it's already taking"
2318.68,1.3600000000001273, 14 seconds.
2320.04,4.639999999999873," So just way, way, way slower program in general."
2324.68,5.360000000000127, And then the relationship seems to be an n squared kind of relationship relating the input
2330.04,3.0799999999999272, to how long the program takes.
2333.12,5.920000000000073," So let's actually plot, well I already did this, but here are the relationships for these"
2339.04,4.519999999999982, sort of three types of algorithms that we've seen so far.
2343.56,5.7199999999998," So this is the finding the element in a list, those three versions, sorry, those two"
2349.2799999999997,4.2400000000002365, versions that we saw and this is the diameter function.
2353.52,7.079999999999927," So if we plot how long it takes the program to run when the input increase, sorry, when"
2360.6,4.519999999999982," the input is this size, we can see that there is a linear relationship."
2365.12,8.559999999999945, So the time it takes for the program to run is linear in the input.
2373.68,5.120000000000346," The diameter, we'll talk about the binary search in a bit, the diameter, we again notice"
2378.8,4.519999999999982," this just by looking at the pure numbers, but it's a lot easier to see it visually."
2384.04,4.720000000000255," This is on the x axis the size of the problem, so how many points we actually are finding"
2388.76,2.480000000000018, the diameter between?
2391.2400000000002,2.0, And how long it actually takes the program to run?
2393.2400000000002,1.8800000000001091, And the relationship is quadratic.
2395.1200000000003,4.639999999999873," Now that we plot it, we clearly see the quadratic relationship."
2399.76,3.9200000000000728," And then this binary search, we were very unsure of what it was, right?"
2403.6800000000003,4.7599999999997635," It wasn't quite constant, it definitely wasn't linear, but now that we've plotted it, so"
2408.44,4.0," this is the input size, and this is how long it actually takes the program to run, you"
2412.44,5.039999999999964," can see it drastically increases when the input size is very small, but then it kind"
2417.48,6.760000000000218," of sort of asymptotically reaches some sort of value, it's actually a logarithmic relationship."
2427.08,5.320000000000164," All right, last thing I wanted to mention about timing before we move on to counting is just"
2432.4,5.7199999999998," purely running, just purely running these functions on different computers, we'll just"
2438.12,3.1200000000003456, give us different values just right off the bat.
2441.24,6.8400000000001455," So for my, on this newer-ish computer, how long did it take to run this compound?"
2448.08,1.0799999999999272," Well, no, what did it take?"
2449.16,3.119999999999891," Like three seconds or something, one point something seconds."
2452.2799999999997,3.6799999999998363," On an older laptop, it took, you know, 663 seconds."
2455.9599999999996,4.2400000000002365," On an even older desktop, it took 1226 seconds."
2460.2,4.360000000000127," Right, so just, you're just purely timing things, the machine you're running it on is going"
2464.56,3.519999999999982," to make a difference, okay?"
2468.08,2.8799999999996544," And then that's fine, right?"
2470.96,4.199999999999818," It's important to know how long it takes, but if you're just looking at the relationship"
2475.16,5.2800000000002," between input and how long the program takes to run, that's the same."
2480.44,4.559999999999945," So it doesn't matter what machine you're running it on, when you increase the input by 10,"
