start,duration,text
0.0,13.44," All right, let's get started."
13.44,7.160000000000002, Last lecture we began talking about an entirely new topic in computer science and we began
20.6,5.119999999999997, learning about how to figure out the runtime of our programs.
25.72,6.520000000000003, So we looked at how to actually time the program by figuring out exactly how long it takes
32.24,2.559999999999995, and then how to count the number of operations in the program.
34.8,4.280000000000001, Today we're going to do very same thing to begin with.
39.08,3.760000000000005, So for the first half of the lecture we'll time a bunch of programs and we'll count the
42.84,3.039999999999992, number of operations just like before.
45.879999999999995,3.8800000000000026," But we're going to do them in a context of slightly different, slightly more interesting"
49.76,5.839999999999996, programs or functions involving just pure numbers as our parameters and then functions
55.6,3.240000000000002, that involve lists as our parameters.
58.84,3.6400000000000006, That'll be the first half of the lecture and then from there on we're going to look at
62.480000000000004,4.159999999999997, the idea of order of growth which is kind of what we're building up this set of lectures
66.64,1.519999999999996, to and then the order of growth.
68.16,6.400000000000006," There'll be a little bit of math, a little bit of graphing but not too much and then we're"
74.56,6.1200000000000045, just going to see how to actually evaluate the order of growth of functions from there
80.68,1.1999999999999886, on out.
82.88,5.319999999999993, So let's begin by just figuring out the run time of our programs.
88.19999999999999,4.0, This was a really quick and easy way to first figure out exactly how long our programs
92.19999999999999,1.0, take.
93.19999999999999,4.920000000000016, So last lecture we imported this time module and we're doing that again this time.
98.12,10.319999999999993," But instead of actually running the time function that we had seen last lecture here, instead"
108.44,7.0, of running the time function which gave us this sort of global absolute time since some
115.44,4.0," date in the past, we're going to run this slightly different function called performance"
119.44,1.0, counter.
120.44,5.799999999999997, This is what is typically used in the real world to figure out how long an actual program
126.24,2.200000000000003, or function takes to run.
128.44,2.6399999999999864, The reason we're using this is because it's more accurate.
131.08,7.360000000000014, So the time.time function that we use last lecture gave us maybe precision to one time
138.44000000000003,4.280000000000001, sent negative three or something very big like that.
142.72000000000003,5.519999999999982, The performance counter can actually give us precision to something that's a lot smaller
148.24,3.4000000000000057, so maybe one time sent negative eight or something very small.
151.64000000000001,6.560000000000002, So we'll be able to see the timings of some functions that were basically zero in the
158.20000000000002,1.6800000000000068, last lecture.
159.88,5.840000000000003," Okay, so just a quick review of how we actually get the time that a function takes to run."
165.72,5.439999999999998, We run this performance counter time and this one gives us not an absolute time but more
171.16,5.640000000000015," of a shorter time frame, not from some time in the past."
176.8,4.559999999999974," And the performance counter is very useful when we're getting these dTs, right, the difference"
181.35999999999999,1.6000000000000227, in some times.
182.96,4.719999999999999, So we're running the performance counter to get the quote unquote starting time.
187.68,4.8799999999999955," We run the function, we run the performance counter again to get the quote unquote stopping"
192.56,3.5600000000000023," time, subtract the starting time to get the dT."
196.12,6.240000000000009," Okay, so and then we will print that time to see how long the function actually takes to"
202.36,1.0, run.
203.36,2.1999999999999886," Yeah, that's the way I said."
205.56,6.8799999999999955," Okay, so we're going to look at two different functions than last time but they're going"
212.44,4.200000000000017, to have sort of the same overarching themes that we saw last lecture.
216.64,4.319999999999993," So the first function we're going to look at is called convert to kilometers, taking"
220.95999999999998,4.439999999999998, in some miles and returns the value in kilometers.
225.39999999999998,3.480000000000018, And the second function is a function named compound.
228.88,3.0, So this one should seem very familiar.
231.88,3.719999999999999, It will bring flashbacks to problem set one.
235.6,5.639999999999986," It's a function that takes in a monthly investment, an interest rate for the month, and some"
241.23999999999998,3.640000000000015, number of months to invest that much.
244.88,3.8799999999999955, And it returns how much money you've made over those number of months.
248.76,5.240000000000009," So you can see here you have an total initialized, a loop that goes through that many months,"
254.0,3.8000000000000114, and it updates the total based on the interest rate and how much money you have there right
257.8,3.079999999999984, now plus whatever you've invested for that month.
260.88,4.160000000000025," Okay, so the three questions we're going to answer just like we answered last lecture is"
265.04,5.7999999999999545," how long, natural seconds does it take to run these functions, which input parameters does"
270.84,2.4399999999999977, the function actually depend on?
273.28,5.560000000000002, And do these two functions actually run for different amounts of time?
278.84,1.759999999999991, And sort of what is that difference?
280.59999999999997,3.2800000000000296," Right, does one run in 12 seconds and the other one run in 0.5?"
283.88,4.9599999999999795," Sorry, what is the actual time that it takes for them to run?"
288.84,4.9599999999999795," So this is our code, so these are the two functions before we go on."
293.79999999999995,2.8799999999999955, Let me just show you how we're creating the inputs.
296.67999999999995,3.7600000000000477," So just like before, we're creating a list of all of the different inputs we're going"
300.44,2.1999999999999886, to run the function with.
302.64,6.480000000000018," So here I've got this Ln that will contain the numbers 1, 10, 100, 1000, so on."
309.12,5.919999999999959," And these are going to be the parameters to my function, one at a time of course."
315.03999999999996,5.1200000000000045," And then I've got my loop here for each one of those inputs, 1, 10, 100, 1000, I'm just"
320.15999999999997,2.3600000000000136," going to run my function, right?"
322.52,2.6000000000000227, So here I'm measuring the time it takes.
325.12,6.319999999999993, And then I'm going to report the time that it took to run the program.
331.44,5.1200000000000045," And just for fun, I'm also going to report how many times this program could run in one"
336.56,1.240000000000009, second.
337.8,4.159999999999968," Because for me it was a little bit hard to read, you know, one time instead of negative,"
341.96,2.7200000000000273," you know, 8 or something like that."
344.68,3.759999999999991, But it was a lot easier for me to see this big number for how many times that function
348.44,3.3600000000000136, could have run in one second.
351.8,6.439999999999998, So here I've got a convert to kilometers.
358.24,8.639999999999986," So I'm going to run it and we're going to see, it's this right here, how long the function"
366.88,1.0, actually took.
367.88,4.400000000000034," So last time we ran a program that was really simple like this, all of it basically said"
372.28000000000003,1.3199999999999932," it took zero seconds, right?"
373.6,4.71999999999997," It was just so fast that that time, that time function was wasn't able to pick up that"
378.32,2.480000000000018, precise time difference.
380.8,2.1999999999999886," But this performance counter can, right?"
383.0,1.0, Which is a lot nicer.
384.0,6.160000000000025," Now we see that no matter what the input it looks like, the time is pretty much the same,"
390.16,1.0, right?
391.16,4.759999999999991," Three times ten negative seven seconds, no matter what the input is."
395.92,3.159999999999968, That was expected.
399.08,3.3600000000000136, Now what about the compound function?
402.44,3.6399999999999864, This one's going to be a little bit more interesting because there are actually three parameters
406.08,2.1200000000000045," to this function, right?"
408.2,5.400000000000034, So what we're going to do is change each one and see which one of those parameters actually
413.6,3.160000000000025, has an effect on the runtime.
416.76000000000005,8.399999999999977, So here this bit is going to fix my interest rate and fix the number of months and I'm
425.16,3.680000000000007, going to change the amount I invest every month.
428.84000000000003,3.0," So if I run that, that was pretty fast."
431.84000000000003,4.279999999999973," Again we look at the results here and no matter how much I invest every month, it looks"
436.12,3.400000000000034," like the program doesn't really change how long it takes to run, right?"
439.52,4.8799999999999955, It's always about one times ten to the negative six seconds to run.
444.4,2.0, All right.
446.4,2.160000000000025, What if I change the interest rate?
448.56,2.7999999999999545, So this one was a little bit harder to change.
451.35999999999996,7.160000000000025," What I settled on this as the thing I'm varying, sorry, I'm varying it in this way."
458.52,6.639999999999986, So it's going to be 1.01 or 1.01 or 1.001.
465.16,4.480000000000018," That's what I'm going to invest, the interest rate for whatever I'm going to invest in and"
469.64000000000004,6.599999999999966, I'm going to fix $10 as my investment per month and fix the 12 months again.
476.24,7.920000000000016," So if I run that same deal, it looks like changing this investment isn't really making much"
484.16,3.480000000000018, of a difference in how long it takes the program to run.
487.64000000000004,2.1200000000000045, All right.
489.76000000000005,2.319999999999993, One last parameter to try.
492.08,5.399999999999977, So now I'm going to fix the initial investment to $10 a month and I'm going to fix my interest
497.47999999999996,7.720000000000027, rate to this per month and I'm going to vary how many months I'm going to invest this.
505.2,6.399999999999977," So again this N will be 1, 10, 100, 1,000, 10,000 and so on."
511.59999999999997,2.4399999999999977, So let's see what this is going to do.
514.04,1.0, All right.
515.04,3.6800000000000637," It's doing something different than the other two because it hasn't finished running yet,"
518.72,1.0, right?
519.72,2.480000000000018, So I'm working on this last one down here.
522.2,3.8799999999999955," But we can see that more interesting things are happening now, right?"
526.08,5.67999999999995, So here I've got initially it's a little bit hard to tell for those small numbers which
531.76,5.519999999999982," is fine, but luckily we're able to run it for a bunch of inputs."
537.28,6.360000000000014," So starting from about here, right, when I start investing my money over 1,000 months,"
543.64,5.560000000000059," 10,000 months, 100,000 months and so on, it looks like we can kind of see a pattern."
549.2,4.600000000000023," For a thousand months, the program takes about five times 10 to negative five seconds"
553.8000000000001,1.0, to run.
554.8000000000001,5.639999999999986," If I increase the number of months by 10, it takes five times 10 to negative four seconds"
560.44,1.0, to run.
561.44,6.399999999999977," And then as my input increases by 10, the number of months, my time to run seems to increase"
567.84,1.8799999999999955," by 10 as well, right?"
569.72,8.440000000000055," So 0.005, 0.05, 0.7, 0.8, something like that."
578.16,1.4800000000000182, Okay.
579.64,2.439999999999941, So this is from a previous run.
582.0799999999999,4.960000000000036," Of course, each run will be different because we're just purely grabbing the time that the"
587.04,1.8400000000000318, program took to run.
588.88,2.0399999999999636, So the actual time will be different.
590.92,2.6000000000000227, But a few things to notice.
593.52,4.439999999999941," So Python actually reported the time it took the program to run in scientific notation,"
597.9599999999999,1.1600000000000819, which is kind of cool.
599.12,2.519999999999982, So this is 4.3 times 10 to the negative six.
601.64,2.2799999999999727, So it knew how to show it to me like that.
603.92,4.2000000000000455," So it's not, it doesn't have a bunch of zeros in there."
608.12,9.32000000000005, And then the observation as you might have guessed for this convert to kilometers was independent.
617.44,4.0," So this is the kilometers, not the compound function."
621.44,5.159999999999968," But then the compound function here, this is again from a previous run."
626.6,2.480000000000018, We can make a few observations.
629.08,8.639999999999986, So the first was that the time only actually changed with the input when we changed
637.72,1.7200000000000273, end months.
639.44,5.360000000000014," When we changed the initial investment or the interest rate, the program just basically"
644.8000000000001,1.9599999999999227, took the same amount of time to run.
646.76,4.360000000000014, So it was only end months that actually made a difference for us.
651.12,5.1200000000000045," Second observation, again, something we noticed is as we increase the number of months by"
656.24,5.1200000000000045," 10, the time it takes the program to run also increases by 10."
661.36,2.840000000000032," Again, something we've talked about."
664.2,11.279999999999973, The last observation is that we have this relationship very apparent as the input is really
675.48,1.0, big.
676.48,1.0, Right?
677.48,5.519999999999982," As the input is small, I think I mentioned this last time, if for some reason my computer"
683.0,6.2000000000000455, updates or decides to dedicate some resources to running an app in the background for
689.2,6.0," what reason as it's trying to figure out the compound function with an input of one,"
695.2,2.840000000000032, this number could be changed dramatically.
698.0400000000001,5.360000000000014, Because two times 10 negative six can be affected a lot by just a little bit of time dedicated
703.4000000000001,1.599999999999909, to something else.
705.0,6.080000000000041," Whereas four seconds or 14 seconds, if my computer dedicates a little bit of time to something"
711.08,3.7999999999999545," else, that four or 14 won't be affected as much."
714.88,6.080000000000041," So when the numbers are big, that's when we can see the behavior of our function a lot"
720.96,1.0, more clearly.
721.96,2.4799999999999045, Not when the numbers are small.
724.4399999999999,2.240000000000009, Okay.
726.68,5.360000000000014, So now I'd like to look at some more functions.
732.04,5.840000000000032, These functions are going to have the input being a list as opposed to just numbers.
737.88,3.840000000000032," We've seen a bunch of examples with numbers, but let's see what happens when my input is"
741.72,1.67999999999995, a list.
743.4,2.5599999999999454, So here's a very simple function.
745.9599999999999,7.800000000000068, It takes in a list L and it sums all of the elements in the list L. So we've seen a bunch
753.76,1.3999999999999773, of times already.
755.16,2.159999999999968, We initialize a total to be zero.
757.3199999999999,5.160000000000082, We iterate through each element in L and we keep our running total by just adding the
762.48,2.0799999999999272, element to that total.
764.56,3.1200000000000045, Pretty simple and we return it.
767.68,5.480000000000018, Now how do we actually run this function with a whole bunch of different inputs?
773.16,2.32000000000005, Well that's what we're going to see next.
775.48,4.959999999999923, So this bit here is exactly the same as before.
780.4399999999999,5.920000000000073," It's actually creating for us the list of one, ten, a hundred, a thousand, ten thousand"
786.36,1.5599999999999454, and so on.
787.92,6.0," But clearly the number ten cannot be an input to this function, right?"
793.92,3.6000000000000227," Because this function is expecting a list, right?"
797.52,1.6000000000000227, So L cannot be ten.
799.12,2.7199999999999136, It needs to be a list with some things in it.
801.84,5.600000000000023," So instead what we're going to do out of that number, one, ten, a hundred, a thousand"
807.44,4.8799999999999955," and so on, we're actually going to make a list with just some random dummy numbers in"
812.32,1.0, it.
813.32,1.4800000000000182, I don't actually care what these numbers are.
814.8000000000001,4.599999999999909," So let's just make them be the number zero to nine, zero to ninety nine, zero to nine"
819.4,1.5600000000000591, hundred and ninety nine.
820.96,4.32000000000005," And in effect each one of these lists will then have one element in it, ten elements"
825.2800000000001,4.239999999999895," in it, a hundred elements in it, a thousand elements in it and so on."
829.52,2.32000000000005," Okay, everyone, okay with that."
831.84,1.0, So the input is now different.
832.84,1.0, It needs to be a list.
833.84,4.639999999999986, We're just creating a bunch of lists of varying lengths.
838.48,4.639999999999986, So the relationship between these lengths are that the lists are ten times as big as the
843.12,3.240000000000009," previous list, right?"
846.36,2.6399999999999864, So then now I have my input list here.
849.0,2.2799999999999727, I do the exact same thing as before.
851.28,1.2000000000000455, Not yet.
852.48,4.159999999999968, I run the performance counter to create my starting time.
856.64,2.3999999999999773, I run my function and I get the dt.
859.04,2.5599999999999454, And I report the exact same thing as before.
861.5999999999999,4.440000000000055," All right, so let's run that."
866.04,4.32000000000005, Down here.
870.36,4.519999999999982," All right, running, running, running."
874.88,1.5199999999999818, Again we have to wait a little bit.
876.4,4.519999999999982," It looks like it's working, but it's just getting slower and slower, which is fine."
880.92,2.6000000000000227, So what do we notice?
883.52,4.279999999999973," So when we had one element in my list, it took one time, ten negative five seconds to"
887.8,1.0, run.
888.8,3.67999999999995," When I had ten, it took one time, ten negative six seconds to run."
892.4799999999999,3.7200000000000273, It was actually shorter to have more elements in it.
896.1999999999999,5.519999999999982," See, this is what I mean when it's very unpredictable for low numbers."
901.7199999999999,6.840000000000032," But as we get to lists of length, a thousand, ten thousand, a hundred thousand, a million"
908.56,2.8799999999999955," and so on, we can start to see the pattern."
911.4399999999999,3.6000000000000227," So with ten thousand, it took four times ten negative four seconds to run."
915.04,3.9600000000000364," With a hundred thousand, it took four times ten negative three seconds to run."
919.0,5.319999999999936," And then as the input increases by ten, that is the length of my list increases by ten,"
924.3199999999999,4.240000000000009, it looks like the program takes ten times as long to run.
928.56,3.480000000000018, A very similar thing as before.
932.04,6.759999999999991, So the first observation that we can make out of this function is that the size of the
938.8,3.0399999999999636," input obviously is now the length of our list, right?"
941.8399999999999,2.6000000000000227, It's not just the number ten or the number a thousand.
944.44,6.440000000000055, It's a length of length ten or a list of length a thousand.
950.8800000000001,6.599999999999909," Second observation is that, again, just like in the previous case, the average time increases"
957.48,3.6399999999999864, by ten as the length of our list increases by ten.
961.12,4.240000000000009," Again, very good."
965.36,4.8799999999999955," And just like before, this relationship between the size and time is more predictable for"
970.24,3.240000000000009," large sizes than it was for small sizes, right?"
973.48,6.159999999999968," As we just saw here, which will surprise me a little bit as well, is for a list that's"
979.64,3.560000000000059," longer, it took a shorter amount of time to run."
983.2,4.600000000000023," Just counterintuitive, but again, that's probably because my computer did something here"
987.8000000000001,6.519999999999982, to take a little bit longer to run.
994.32,5.199999999999932," And then the last observation, this is compared to the compound function where we change the"
999.52,1.3999999999999773, number of months.
1000.92,5.8799999999999955," It looks like the time that this program actually takes to run is pretty comparable, just in"
1006.8,6.1200000000000045," terms of pure seconds, is comparable to how long it took for the compound to run, right?"
1012.92,5.240000000000009," So here when my input was a hundred million, I think, yeah, a hundred million, it took"
1018.16,1.919999999999959, about eight seconds to run.
1020.0799999999999,5.680000000000064," And when my list had a hundred million elements in it, it took about seven seconds to run, right?"
1025.76,8.519999999999982, And then ten times faster going when we decrease our input by ten.
1034.28,4.120000000000118, So already we're starting to see something that we're going to get.
1038.4,1.0," Yeah, go ahead."
1039.4,2.9199999999998454, What is the sum of function?
1042.32,3.160000000000082, Is that different from that?
1045.48,2.8799999999998818," Oh, sum of is just this function that I wrote here."
1048.36,1.759999999999991," Yep, that's just, yeah."
1050.12,1.5600000000001728, Did I name it something differently in here?
1051.68,1.0, No.
1053.68,1.0, Yeah.
1054.68,6.319999999999936, So already we're starting to get at this idea where I have two functions that do wildly
1061.0,2.3600000000001273," different things, right?"
1063.3600000000001,1.4399999999998272, One sums the elements in a list.
1064.8,4.240000000000009, The other one just loops over some number of months and does some calculation.
1069.04,5.120000000000118," But it looks like they're sort of in terms of just algorithmically wise, they are very"
1074.16,1.0, similar.
1075.16,1.7200000000000273, They take similar amounts of time.
1076.88,2.6800000000000637, They increase at the same rate.
1079.56,2.119999999999891," And basically they just have a for loop, right?"
1081.6799999999998,3.240000000000009, Or some sort of loop that iterates through the input and does something.
1084.9199999999998,4.320000000000164," So algorithmically we want to consider both of these functions the same, even though they"
1089.24,5.0, implement completely different things.
1094.24,4.639999999999873, Other questions before we go on to another list function.
1098.8799999999999,1.240000000000009, Okay.
1100.12,5.759999999999991, So let's look at a slightly different problem dealing with lists.
1105.88,5.599999999999909, So this function or these three functions deal with finding an element in a list.
1111.48,4.080000000000155, And we're going to compare the runtimes of these three functions.
1115.5600000000002,5.639999999999873, So the first function is going to be a very brute force method to find the element in
1121.2,1.8400000000001455, a list.
1123.0400000000002,2.0399999999999636," It's going, was there a question?"
1125.0800000000002,1.0, Yeah.
1126.0800000000002,1.0, Yeah.
1127.0800000000002,4.240000000000009," Oh, wait, I think you're running out."
1131.3200000000002,2.2000000000000455," All right, no worries."
1133.92,6.959999999999809," Okay, so the first function will do a brute force search to find an element x right here,"
1140.8799999999999,4.240000000000009, one of my parameters within a list of the other one of my parameters.
1145.12,7.080000000000155," Basically, given a list of a bunch of elements, this function will just painstakingly look at"
1152.2,6.720000000000027, each element one at a time and ask whether that element is the one that I'm looking for.
1158.92,4.1599999999998545," So starting over here, the beginning of my list and going to the end of my list."
1163.08,4.160000000000082, That's what is in does.
1167.24,5.959999999999809," The next one, binary search, also looks for an element in a list, making sure that the"
1173.1999999999998,1.8800000000001091, list is ordered.
1175.08,3.7200000000000273, But the way that it's going to do it is in a slightly smarter way.
1178.8,4.079999999999927, So I'm actually going to draw my list this way.
1182.8799999999999,4.080000000000155, So each one of these is going to be elements in my list.
1186.96,4.7199999999998, So this is going to do a bisection search to find the element in the list.
1191.68,4.839999999999918," So again, we're looking for element x within this list L."
1196.52,9.88000000000011," And remember, by section search, we start with a beginning endpoint and an ending endpoint."
1206.4,6.599999999999909," And our first guess for the element or whatever we're looking for is to just say, what's"
1213.0,1.1600000000000819, the middle element?
1214.16,4.279999999999973," All right, so look at the element in the middle and ask, are you the one I'm looking for?"
1218.44,4.160000000000082," In this particular case, you look at the element in the middle and you say, are you the"
1222.6000000000001,1.5199999999999818, x I'm looking for?
1224.1200000000001,1.0, Good.
1225.1200000000001,5.2000000000000455, So that's this one right here.
1230.3200000000002,4.039999999999964, So the midpoint calculation is right here.
